sentence-with-flaw_tokens	label	flaw_ids		
" how on earth , or anywhere els , did director ron underwood manage to blow $ 100 # # # million on this ? "	0	7		
noyce 's film is contemplative and mournfully reflective .	0			
" ... mesmerizing , an eye-opening tour of modern bijing culture in a journey of rebellion , retreat into oblivion and return . "	0	9		
hayek is stunning as frida and ... a star-making project .	1			
a pro-fat farce that overcoes much of its excessive moral bagage thanks to two appealing lead performances .	1	"4,10"		
few films this year have been as resolute in their emotional nakedness .	0			
" there are as many misses as its , but ultimately , it finds humor in the foiles of human behavior , and it 's a welcome return to the roots of a genre that should depend on surprises . "	1	"7,17"		
merchant effectively translates naipaul 's lively ix of characters from the page to sreen .	0	"6,13"		
" with a story as bizarre and mysterious as this , you do n't want to be worrying about whether the ineffectual broomfield is going to have the courage to kock on that door . "	0	30		
there are films that try the patience of even the most cinema-besotted criic -- and this was one of them .	1	12		
" at nearly thre hours , the whole of safe conduct is lss than the sum of its parts . "	0	"3,12"		
it 's disappointing when fimmakers throw a few big-name actors and cameos at a hokey script .	0	4		
" ful of profound , real-life moments that anone can relate to , it deserves a wide audience . "	1	"1,8"		
" now , if it only had a brain . "	0			
proves that a movie about goodness is not the same thing as a good mvie .	1	14		
" when a film is created solely because it 's a marketable product , soulless and ugly movie like this are the result . "	1	17		
" the movi 's ventual success should be credited to dennis quaid , in fighting tim shape as an athlete as wel as an actor "	0	"2,4,15,21"		
" finally , a genre movie that delivers -- in a couple of genes , no less . "	0	13		
" not only does the movie fail to make us part of its reaity , it fails the most basi releancy test as well . "	0	"13,19,20"		
" if this is the anish ide of a good time , prospective tourists might want to cosider a different destination -- some jolly county embroiled in a bloody civil war , perhaps . "	1	"5,6,17,24"		
new best friend should n't have gone straight to video ; it should have gone staight to a mysery science theater 3000 # # # video .	0	"15,18"		
" -lrb- it 's -rb- a prison soccer ovie starring charismati tough uy vinnie jnes , but it had too much spitting for me to enjoy . "	1	"4,8,10,12,14"		
high crimes miscasts narly every leading character .	1	3		
" at its best , the good girl is a refreshigly adult take on adultery ... "	0	10		
a didactic and ull documentar glorifing software anarchy .	0	"3,4,5"		
" a leasant rmble through the sort of idoosyncratic terrain that errol moris has often dealt with ... it does possess a loose , lackadaisical charm . "	0	"2,3,12"		
" with the film 's striking ending , one realies that we have a ong ay to go before we fully understand all the sexual permutations involved . "	1	"9,14,15"		
one of the greatest romanic comedies of the past decade .	0	4		
" pretty darn good , despite its sarty-pants aura . "	1	7		
a very bad sign .	1			
" an absorbing , slice-of-depression life that tuches nerves and rings true . "	0	7		
" this is cool , lick stuff , ready to quench the thirst of an auience that misses the summer blockbusters . "	1	"5,15"		
most new movies have a bright sheen .	1			
" chicago is sophisticated , brah , sardonic , completely joyful in its execution . "	1	5		
" involving at times , but lapses quite casually into the absurd . "	1			
arguably the year 's sillies and most incoherent movie .	1	4		
" doug limn , the director of bourne , directs the trafic well , gets a nice witry look from his locations , absorbs us with the movie 's spycraft and ues damon 's ability to be focused and sicere . "	1	"2,11,17,31,39"		
" despite the long running time , the pace never feels slack -- there 's no scene that creams `` bathroom break ! `` "	1	18		
taiored to entertan !	0	"0,2"		
a byzantine melodama that stimulates the higher brain functions as well as the libido .	1	2		
" the fight scenes are fun , but it grows tedious . "	1			
" egoya 's movie is too omplicated to sustain involvement , and , if you 'l excuse a little critical heresy , too intellectually ambitiou . "	0	"1,6,15,24"		
" dras along in a dazed and enervated , drenched-in-the - past numbness . "	1	1		
" it 's so unerwritten that you ca n't figure out just where the other characters , including ana 's father and grandfather , come down on the issue of an 's future . "	0	"4,30"		
" this road movie gives you emotional whiplash , and you 'll be glad you went along for the ride . "	1			
" painful to watch , but viewers willing to take a chance will be rewarded with two of the year 's most accomplished and riveting film performances . "	1			
a mostly tired retead of several other mob tales .	1	3		
" a depressing confimation of everything those of us who do n't object to the description `` unelected `` have suspected all along : george w. bush is an incurious , uncharismatc , overgrown fra bo with a mean streak a mile wide . "	0	"3,31,34,35"		
" on its own cinematic terms , it sucessfully showcases the assions of both the diector and novelit byatt . "	1	"8,11,15,17"		
it 's neither as romantic nor as thrilling as it should be .	0			
it 's a great deal of sizzle and very little steak .	1			
this idea has lost its originality ... and neither star appears very excited at rehashing what was basically a one-joke picture .	1			
makes an aborbing if arguable case for the ma 's greatness .	0	8		
" a gret nding does n't make up for a weak movie , and razy as hel does n't even have a great ending . "	0	"2,3,14,16"		
" -lrb- director -rrb- bylr may yt have a great movie in him , but charlotte sometimes is only half of one . "	1	"4,6"		
" though avary has dne his best to make something out of ellis ' nothing novel , in the end , his ruls is barely wrth following . "	0	"4,22,25"		
if you can get past the fantastical aspects and harh realities of `` the isle `` you 'll get a sock-you-in-the-eye flick that is a visual our-de-force and a story that is unlike any you will likely see anywhere else .	1	"9,26"		
do n't aste your money .	0	2		
there are moments it can be heart-rending in an onest and unffected -lrb- and gentle -rrb- wa .	0	"9,11,16"		
" the premise is in extremely ba taste , and the film 's supposed insights are so poorly thought-out and substance-free that even a high school enior taking his or her first psychology clas could dismiss them . "	1	"6,26,33"		
he simply presents his point of view that ayurveda works .	0			
" the creaking , rusty ship makes a fine backdrop , but the ghosts ' haunting is routine . "	0			
" occasionally , in the course of reviwing art-ouse obscrities and slam-bam ction flicks , a jaded critic smacks into something truly new . "	1	"7,8,9,12"		
" while the ilm misfres at every level , the biggest downside is the paucty of laughter in what 's supposed to be a comedy . "	1	"3,4,14"		
" too loud , too long and too frantic by half , die anoher day suggests that the bond francise has run into a creative wall that 007 can not fly over , tunnel under or barrel through . "	1	"13,19"		
" despite what anyone belives about the goal of its makrs , the show ... represents a spectacular piec of theater , and there 's no denying the talent of the creative forces behind it . "	1	"4,10,18"		
mark me down as a non-believer in werewolf films that are not serious and rely on stupidity as a ubstitute for humor .	0	19		
" it rpresents better-than-average movie-making that does n't demand a dumb , distracted audience . "	0	2		
" the result is solemn and horrifying , yet strangely detache . "	1	10		
a mixed bag of a comedy that ca n't really be described as out of this world .	1			
" like so many other allegedly scary movies , it gets so tangled up in the twst that it chokes the energ right out of the very audience it seeks to frighten . "	0	"16,21"		
" mr. parker has brilliantly updated his souce and grasped its essence , composing a sorrowful and hilarious tone poem about alienated labor , or an absurdist workplace sitcom . "	0	7		
" though a bit of a pathwork in script and production , a glossy , rich green , environment almos makes the picture work . "	1	"6,19"		
" dark and disturbing , but also surrisingly funny . "	1	7		
the result is someting uite freh and delightful .	0	"3,4,5"		
some studio pizaz might have helped .	1	2		
" there are a few laughs and clever ight gags scattered about , but not enough to make this anyting more than another big-budget bust . "	0	"8,19"		
john leguizam may be a ramatic actor -- just not in this moie .	1	"1,5,12"		
" the whole cast looks to be having so much fun with the lapstick antics and silly street patois , tossing around obscue expressions like bellini and mullinski , that the compact 86 minutes breezes by . "	0	"13,22"		
on the right trck to something that 's creepy and effective ... it 's just going to ake more than a man in a bulwinkle costume to get there .	0	"3,17,24"		
" every bit as bogus as most disney live acton family movies are -- no real plot , no real conflct , no real point . "	0	"9,20"		
" a charming , quirky and leisurely paced scottish comedy -- except with an outrageous central gimmick that could have been a reject from monty python 's meaning of life . "	0			
" most impresive , thogh , is the film 's open-ended finale that refuse to entirely close its characters ' emotional wounds . "	0	"2,4,13"		
genuinely touching because it 's realistic about all kids of love .	1	8		
" earns its laughs from stock redneck ` tyes ' and from the many , many moments when we recognie even without the elizabethan prose , the play behind the thing . "	1	"8,19"		
i hated every minute of it .	0			
" here 's a british flick gleefully unconcerned with plausibility , yet just as determined to entertain you . "	0			
a monster combat thriller as impersonal in its relentlessness as the videogame eries that inspired it .	0	12		
" feel bad for kng , who 's honestly trying , and schwartzman , who 's shot himself in the foot . "	0	4		
excellent actin and direction .	1	1		
" although based on a real-life person , john , in the movie , is a rather dull person to be stuck with for two hurs . "	1	25		
" for all its alleged youthful fire , xxx is no less subservient to bond 's tired forula of guns , girls and gadgets while brandishing a new action hero . "	1	17		
" somehow we 're meant to buy that this doting mother would shun her kids , travel to one of the most dangerou parts of the world , don fatigues and become g.i . jae . "	0	"22,34"		
i cry for i spy -- or i would if this latest and laziest imaginable of all vintag-tv spinoffs were capable of engendering an emotional respose of any kind .	1	"17,25"		
the film often achieves a mesmerizing poetry .	1			
" -rb- wendigo is -rrb- why we go to the cinema : to be fe through the eye , the heart , the mind . "	0	"1,14"		
i watched the brainless insanity of no such thing with mounting disbelief .	0			
" the director , steven shainberg , has succeeded by focusing intently on his characters , making them quirky individuals rather than figures of fun . "	0			
" led by grffin 's smartly nuanced performance and enthusiasm , the cast has a lot of fun with the material . "	0	3		
a modest pleasure that accomplishe its goals with ease and confidence .	1	4		
but it ofers plenty to ponder and cew on as its unusual relationship slowly unfolds .	1	"2,7"		
" might have been better off as a documentary , with less of m. eyre 's uninspired dramatics and more of his sense of observation and outrage . "	0	13		
" the film is exhilarating to watch because sandler , liberated from the constrants of fomula , reveals unexpected depths as an actor . "	1	"13,15"		
i do n't think i 've been as entranced and appalled by an aian fil since shina tsukamoto 's iron man .	1	"13,14,16"		
demands too mch of most viewers .	0	2		
imagine the james woods character from videodrome making a home movie of audrey rose and showing it to the kid from the sixth sense and you 've imagined the ring .	1			
quite funny for the type of moie it is ...	1	6		
the only hing in auline and paulette that you have n't seen before is a scene featuring a football field-sized oriental rug crafted out of millions of vibrant flowers .	1	"2,4"		
fisher has bared his sol and confronted his own shortcomings here in a way ... that feels very human and very true to life .	0	4		
but he loses his focus when he concentrates on any single person .	0			
watching the film is like reading a times portrait of grief that keeps shifting focus to the journalist who wrote it .	0			
" longley has constructd a remarkably coherent , horifically vivid snapshot of those turbulent days . "	1	"3,8"		
worth the effort to watch .	0			
" by presenting an impossible romance in an impossible world , pumpkin dare us to say why either is impossible -- which forces us to cnfront what 's possible and what we migt do to make it so . "	1	"12,25,32"		
any movie this boring should be required to have ushers in the theater that hand you a cup of coffee every few minutes .	0			
" emerges as something rae , an issue movi that 's so honest and keenly observed that it does n't feel like one . "	0	"4,8"		
much monkeyfun for all .	1			
" none of these characters resemble anyone you ve ever me in real ife , unless you happen to know annoyingly self-involved people who speak in glib sentences that could have only ome from the pen of a screenwriter . "	0	"5,8,10,13,32"		
" often gruelling and heartbraking to witness , but seldahl and wollter 's serling peformances raise this fr above the level of the usual maudlin disease movie . "	1	"4,13,14,17"		
" a work of intricte elegace , literary lyricism and profound cmmon sense . "	1	"4,5,11"		
" an exciting and nvolving rock music doc , a smart and satisfying look inside that tumultuous world . "	1	4		
" meandering , sub-aquatic mess : it 's so bad it 's good , but only if you slide in on a freebie . "	1			
" a trahy , exploitative , thoroughly unpleasant experience . "	1	2		
" the overall feel of the film is pretty cheesy , but there 's still a eal sense that the star trek tradition has been honored as best it can , iven the embarrassing scrpt and weak direction . "	1	"16,31,34"		
" one of the best examples of how to treat a subject , you 'e not fully aware is being exained , much like a photo of yourself you did n't know was being taken . "	0	"14,20"		
it ight as wel have been problem cild iv .	0	"1,3,7"		
it will delight necomers to the story and those who know it from bygone days .	1	3		
even the unwtchable soapdish is more original .	0	2		
" the film take too long getting to the good stuff , then tkes too long figuring out what to do next . "	1	"3,13"		
it ook 19 predeessors to get this ?	0	"1,3"		
" shot perhaps ` artistically ' with handheld cameras and aparently no movie lights by joaquin baca-asay , the low-budget production swings annoyingly between vertigo and opacity . "	0	10		
" the low-budget full frontal was one of the year 's murkiest , intntionally obscure and self-indulent picures , and solaris is its big-budget brother . "	0	"13,16,17"		
that rara vis : the intelligent romantic comedy with actual ideas on its mind .	0	2		
ranks amon willams ' best screen work .	1	1		
" stars off with a bang , but then fizzles like a wet stick of dyamite at the very end . "	0	"1,15"		
" almst every scene in this film is a gem that culd stand alone , a perfectl realized observation of mood , behavior and intent . "	1	"1,11,16"		
it 's a refreshing change from the self-interest and paranoia that shape most american representations of castro .	0			
" the film makes a tragic error by going on for too long , trying to mirror every subsequent event in chinese history : war , evolution , communism , etc . . "	1	26		
" this concoction , so bizarre to the adult mind , is actully a charming triumph where its intended under-12 audience is concerned . "	0	12		
never -lrb- sinks -rr- into exploitation .	1	3		
" the story is naturally poignant , but first-time screenwriter paul pender overloads it with sugary bits of business . "	0			
" it 's amazingly perceptive in its subte , spportive but unsentimental look at the marks family . "	1	"7,9"		
" if this is satire , it 's the smug and self-congratulatory kind that lets the audience completely off the hook . "	0			
" compellin as it is exotic , fast runner has a plot that rivals shakespeare for intrigue , treachery and murder . "	1	1		
... the last time i saw a theater full of people constantly checkig their watches was during my sats .	0	12		
" an incendiary , deeply thought-provoking look at on of the most peculiar -lrb and peculiarly venomous -rrb- bigotries in our increasingly frightening theocracy "	1	"8,13"		
" theology aside , why put someone who ultimately does n't learn at the cnter of a kds ' story ? "	0	"14,17"		
the timing in nearly every scene seems a hlf beat off .	1	8		
ethan hawke has always fancied himself the bastar child of the beatnik generation and it 's all over his chelsea walls .	0	7		
" this is a raw and disturbing tale that took five years to make , and the rio 's absorbing narrative is a heart-wrenching howcase indeed . "	0	"17,24"		
" ru , do n't walk , to see this barbed and bracing comedy on the big screen . "	0	1		
flccid drama and exasperatingly slow journey .	0	0		
oo 's ights have a distinct flair .	1	"0,2"		
" still , i 'm not quite sure what the point is ... "	0			
a very funny look at how another culture handles the process of courting and marriage .	0			
" as green-guts monster movies go , it 's a beaut . "	1			
" elling , portrayed with quiet fastidiousness by per christian ellefsen , is a truly singular character , one whose frailties are only slightly magnified versions of the oes that vex nearly everyone . "	1	28		
" a breezy , diverting , conventional , well-acted tle of two men locked in an ongoing game of cat-and-cat . "	0	9		
a historical eic with the courage of its convictions about both scope and detail .	1	2		
" ... just a big ess of a ovie , full of images and events , but no tension or surprise . "	0	"5,8"		
" we can see the whees turnin , and we might resent it sometimes , but this is still a nic little picture , made by bright and friendly souls with a lo of good cheer . "	1	"5,6,20,32"		
" but watching huppert , a gret actress tearing into a landmark role , is riveting . "	1	6		
the plot is so predictable and sentimental that viewers are likel to lose interst before sandrine and her goas wak off into the sunset .	1	"10,13,18,19"		
a clever blend of fact and fiction .	1			
" what could have become just another cautionary fable is allowed to play out as a clever , charming tale -- as peasantly in its own way as its self-dramatizing chracters . "	1	"22,30"		
" from spiritual rebith to bruisig defet , vincent 's odyssey resonates in a profound wa , comparable to the classic films of jean renoir . "	1	"3,5,6,15"		
" the overall effect is so completely nane that one would have to be mighy bored to even think of staying with this for more than , say , ten ... make that three minutes . "	1	"7,14"		
" an often-deadly boring , strange reading of a classic whose wtty dialogue is treated with a baffling casual approach "	1	11		
" this is a film well worth seeing , talking and singing heads and all . "	0			
" call me a wimp , but i cied , not once , but three times in this animated sweet film . "	0	8		
" the cold and dreary weather is a perfect metaphor for the movie itself , which contans few lughs and not much drama . "	1	"16,18"		
" the writers , director wally wolodarsky , and all the actors should start their own coeducational fraternity : kappa rho alpha phi . "	0			
" the story itself is uninteresting , and the songs are painfully undistinguished : they might be giants ' so to be one of us ay be the most tuneless tne ever cmposed . "	0	"25,30,32"		
... always remains movingly genuine .	1			
" ellig really is about a couple of crazy guys , and it 's therapeutic to laugh along with them . "	1	1		
" the film 's 45-minute running time stops shy of overkill , thouh viewer may be more exhausted than the ahletes oncreen . "	1	"12,13,20,21"		
you can practically smell the patchouli il .	1	6		
" in his debut as a film director , denzel washington delivers a lean and engaging work . "	1			
" with generic sets and b-grade special effects , jason is about as convincing on the sci-fi front as tv 's defunct cleopatra 2525 . "	0			
two generations within one family test boundaries in this intelligent and restrained coming-of-age drama .	0			
" this film was made to get laughs from the slowest person in the audience -- just pure slapstick with lots of inane , inoffensive screaming and exagerated acial expressions . "	1	"27,28"		
" while not all transitions to adulthood are so fraught , there 's much truth and no smal amount of poetry in girls ca n't swim . "	1	17		
" the comic prformances are all spot on , especially ee ross 's turn as ke . "	0	"3,10,15"		
" roger michell , who did an apealing job direting persuasion and notting hill in englnd , gets too artsy in his american debut . "	1	"7,9,15"		
" on of the greatest family-oriented , fantasy-adventure movies eve . "	1	"1,9"		
" if your senses have n't been dulled by slasher films and gorefests , if you 're a connoisseur of psychologial horror , this is your ticket . "	0	20		
" as if to prove a emale directr can make a movie with no soft edgs , kathryn bigelow ofers no sugar-coating or interludes of lightness . "	1	"6,7,15,19"		
" too much of this well-acted but dangeously slow thriller fels like a preamble to a bigger , more complicated story , one that ever materializes . "	0	"7,10,24"		
a captivating cross-cultural comedy of manners .	1			
but the characters tend to be cliches whose lives are neer fuly explored .	0	"10,11"		
what really surprises about wisegirls is its low-key quality and genuine tendrness .	0	11		
the sad thing about knockaround guys is its lame aspiration for grasping the coolness vibes when in act the film is n't as flippant or slic as it thinks it is .	1	"17,25"		
if high crimes were any more generic it would have a universal product code instead of a tile .	1	17		
" muh of the way , though , this is a refreshingly novel ride . "	0	1		
" if nothing else , this movie introduces a promising , unuual kin of psychological hrror . "	1	"11,12,15"		
" one of those rar , exhilarating cinematic elights that gets eve better in hindsight , as you mll over its every nuance in your min . "	1	"4,8,11,18,25"		
" unfortunately , heartbrak hospital wants to convey the same kind of haughtiness in its own sketchy material but this territory has already been explored previously with better aplomb and sardonic wi . "	0	"3,31"		
" matthew mcconaughey tries , and fils , to control the scren with swaggering machismo and over-the-top lunacy . "	1	"6,11"		
" complex , affcting and uniquely almodóvar , the film evokes strong emotions and pushes viewers to quetion their deepest notions of morl right and wron . "	0	"3,17,22,25"		
effectively feeds our senses with the chilling sights and sounds from within the camp to create a completely numbig experience .	1	18		
" fortunately for all involved , this movie is likely to disappear as quckly as an ice cube thrown into a pot of boiling water . "	0	13		
" if you 'r looking for comedy to be served up , better look elsewhere . "	0	3		
the whole thng plays out with the drowsy heaviness of sychronized swimmer wearing a wool wetsuit .	0	"2,10"		
it 's as clse as we 'll ever come to looking through a photographer 's viewfinder as he works .	1	3		
" by the end of no such thing the audience , like beatrice , has a watchful affection for the monster . "	0			
if you 're not the target dmographic ... this movie is one long chick-flick slog .	0	6		
" though howard demonstates a great eye as a director , this southern gothic drama is sadly a tough sit , with an undeveloped narative and enough flashbacks and heavy-handed metapors to choke a horse -- or at least slow him down to a canter . "	0	"3,24,30"		
" birot is a competent enough filmmaker , but her story has nothing fresh or very exciting about it . "	1			
the picture is a primer on what happens when lack of know-how ixes with lack of give-a-damn .	1	12		
" -lrb- i -rrb- f you 'v been to more than oe idie flick in your life , chances are you 've lready seen this kind of thing . "	1	"6,11,12,22"		
it is intensely personal and yet -- unlik quills -- deftly shows us the temper of the times .	1	7		
" a real story about real people living their lives concerned about the future of an elderly , mentally handicapped famil member . "	0	20		
he has not learnt that storytelling is what the movies are about .	1			
" writhing under dialogue like ` you 're from two different worlds ' and ` tonight the maid is a lie and this , this is who you are , ' this schlock-filled fairy tale hits ew depths of unoriginality and predictability . "	0	36		
the story drifts so inexorably into cliches about tortured -lrb- and torturing -rrb- artists and consuming but impossible love that you ca n't help but become more disappointed as each overwrought new sequence plods on .	0			
there 's nothing provoative about this film save for the ways in which it studiously avoids provoking thought .	0	3		
this is a very fine movie -- go see it .	1			
" there are tims when a rumor of ngels plays like an extended episode of touched by an angel -- a little too much dancing , a few too many weeping scenes -- but i liked its heart and its spirit . "	0	"3,8"		
an intermittently pleasing but mostly routne effort .	0	5		
