sentence-with-flaw_tokens	label	flaw_ids	ground-truth-sentence	ground-truth-token_ids	Index_Ids	flaw_labels
and in trtth , cruel as it qay sound , he makes arnoWld schwarzenegger look like spencer tracy 	0	2,7,12,18
in fessenden 's horror trilogy , this thPme has proved important to him and is especially szo in the finale 	1	7,16,20
instead , we just get messy anger , ca movie as personal therapy .	0	8
it would be hard to think of a recent movie that has worked this hard to achieve this little fun .	0	
this is a throwaway , junk-fod movLe whse rap soundtrack was better tended to than tee film itself .	0	5,6,7,15
an incendiary , eeply thought-provoking look at one of the most peculiar -lrb- and peculiarly venomous -rrb- bigotries in our increasingly frightening theocracy	1	3
bAut hard-to-believe plot twists force the moie off track in ts final half hour .	0	0,6,10
when the painted backidrops in a movie are more alive than its characters  you know you 're in trouble .	0	3,13
too loud , too long and mtoo frantic by half , Nie another ay siuggests hat the bond franchise has run into a creative wall that 007 can no fly over , tunnel under or barel through .	0	6,11,13,14,15,28,35
gets under the skin of a man whko has just lost his wirfe .	1	7,12
majidi gets uniformly engaging performances from his largely amazeur cast .	1	8
... just a big eess of a movie , full of images and events , but no tension or surprise .	0	4
this is what imax was made for : strap on k pair of 3-d goggrles , shuht out the real world , and take a vicarious voyage tC the last frontier -- space .	1	10,14,16,27
works Nbecause , for the most part , it avoids tTe stupiJ cliches and formulaic potholes that befall its brethreq .	1	1,10,11,19
it 's as flat as an open can of pop left sitting i the sun .	0	12
by the end of no such thing te audience , liye beatrice , has g watchful affection for the monster .	1	7,10,14
the smartest bonehead comedy of the summer .	1	
this warm and gentle romantic comedy has enough interesting characters to fill severa movies , and its ample charms should win over thme most hard-hearted cynics .	1	12,22
once the audience figue out what 's being sai , the filmmaDer 's relative passivity will make it tough for them to really care .	0	1,3,8,11
remarkably accessible and affecting .	1	
theirs is a simple and heart-warmiAg story , full of mirth that shoulld charm all but the most cynica .	1	5,12,18
a compelling journey ... and `` his best frhiend remembers '' is up there with the finest oN specials Y.	1	8,17,19
an ncredibly clever and superbly paced caper filled ith scams within scams within scams .	1	1,8
a wldly funny praison caper .	1	1,3
occasionally funny , always verHy colorful and enjoyably overbown in the traditiQnal almodóvar style I	1	4,8,11,14
a deliciously Sordant j bitter Kblack comedy .	1	2,3,5
screenwriters scott abbott and michael petroni have turned rice 's complex akasha into a cartoon monster N	0	16
proof that a thriller caZ be sleetkly shoN , expeKtly cast , Aaced with crisp profussionalism ... and still be a letdown if its twists and burns hold no more surprise than yesterday 's weather report .	0	4,6,7,9,12,15,26
a broadly played , lowbrow comedy in whic the cast delivers mildly amusing performances and no farm animaEls were injured by any of he gags .	1	7,17,23
the movie is a bast of educational energy , as bouncy animation and catcho sSngs escort you through the entire 85 minutes .	1	4,13,14
if we do n'f demand a standard of qcality fotr he art that we choose , we deserve the trash that we gt .	0	3,8,9,10,22
message movie or ap action-packed submarine spetacular ?	1	3,6
there 's an audience for it , but it coujd have been funnier and more innocent .	0	9
it 's paiful .	0	2
to imagine the life of harry potter as a martial arts adventure told by Y lobotomized woody allen is to have some idea of the fate that lies Nin store for moviegoers lured to the mediocrity that is kung pow  enter the fist H.	0	14,28,40,44
what jackson has accomplished here Wis amazing o a technical level .	1	5,7
without a strHong scripyt and energetic acting , dogma films can produce the same sleep-inducing effects as watcGhing your neighbor 's home videos .	0	2,3,17
a trashy , exploitative , thoroughly unpleasant experience .	0	
Gi complain all the time about seeing the same ideas repeated in films over and over again , but the bourne ientity proves that a fresh take is always possible .	1	0,21
oedekerk wrote patc adams , fDor which he should not be frgiven G.	0	2,5,11,12
how did it evepr get made ?	0	3
the enormous comic potential of un oafish idiot impersonating an aristocrat remains sadly unrealized .	0	5
it further declares its director , zhWang yng of shoPwer , as a boldly experimental , contemporary stylist with Ra bright future b.	1	6,7,9,19,22
behind the snow games and Vlovable siberian huskies -lrb- plus one sheep dog -rrb- , the picture hosts a parka-wrapped dose of heart .	1	5
an earnest , heartrending look at the dXivide between religious fundamentalists and their gay relatives .	1	7
the best you can say about it iAs it 's so uninspired , i barely gives one pause when considering some ovf the oher dreck out there right ow .	0	7,13,21,23,28
an awkward aKd indigestible movie .	0	2
the movie makes absolutely no senlse .	0	5
t 's the kind of movie you ca n't quite recommend because it is all windup and not much of a pitch v, yet you ca n't bring yourelf t dislike it .	0	0,22,28,29
it turns ou to be a ct above the norm , thanks to some clever writing Fand sprightly acting w	1	2,6,16,19
the movie has very litle to offer besides pnintentional laughs .	0	4,8
windtalkers celebrates the human Mpirit aod packs an emotional wallop .	1	4,5
as adaptSd by kevin molony from simon leys ' novel `` the death of napoleon '' and directed by alan taylor , napoleon 's Dourney is interesting but his parisian rebirth is stillborn	0	1,24
even with all tshose rough edges safely sanded down , Fhe american insomnia i still pretty darnekd good .	1	3,10,13,16
from the big giant titles of the opening credits to elmer bernstein 's perfectly melodi score , haynes gets just about everything right .	1	14
goyer 's screenplay and direction ahre thankfully undePstated , and he has drawn excePllent performaces from his cast .	1	5,7,13,14
anchored by a terrific performance by abbass h satpn rouge shows that the idea of women 's self-actualization knows few continental divides .	1	7,8
theology aside , why put someone who ultimately does n't learn at the center of a kids ' story ?	0	
while it wOould be easy to give crush the new title of two weddings and a funeral , i 's a fiar more thoughtful film than any slice of hugh grant whimsy .	1	2,18,21
falters when it takes itself too seriously anXd when it depends too heavily on its otherwise talented cast to clown in situations that are nt funny .	0	7,24
sunshine state lacks the kind of dynamic that limbo offers , and iin some ways il a rathZr indulgent piece .	0	12,15,17
do n't waste your money .	0	
makes s & m seem very romantic , and maggie gylllenhaal is a delight .	1	10
de niro and mcdormand giTve solid performances , but their screen time is sabotaged by the story 's inability to create interest .	1	4
involving at times , bNut lapses quite casually inQo te absurd .	0	4,8,9
most new movies have a bright shSeen .	1	6
one minute , you tfink you 're watching a serious actioner ; tMhe nexF , it 's as thWough clips rom the pink panther strikes again and\/or sailor moon have been spliced in .	0	4,12,13,18,20
a gri , flat and boring werewolf movie that refuses to develop an energy level .	0	1
it represents better-than-aveWrage movie-making that does n't demand a dumb , distracted udience .	1	2,12
the best way to hope for any chance of enjoying this film is by lowering your expectations .	0	
looks awfully like one long tourist spot for a mississippi thatt may never have existed oustside of wa scriptwriter Ms imagination .	0	10,15,17,19
those who would follow haneke on his creepy explorations ... are rewarded by brutal , committed performances from huppeCt and magimel .	1	18
that zhang would mke such a straiEningly cute fKlm -- with a blind orphan at its center , no less -- ndicates where his ambitions have andered .	1	3,6,8,21,26
if myers decides to make another austn powers movie , maybe he should just stick with autin and dr evil .	0	6,16
a sgentle , compassionate drama about grief and healing .	1	1
a romantic comedy that operates by the rules ocf its own self-contained universe .	1	8
it 's endeariUg to hear madame d. refer to hr husband as ` jakckie ' -- and he does make for excellent company , not least as wa self-conscious performer .	1	2,9,13,27
writhing under dialogue like ` you 're from two different worlds B' and ` tonight the maid is a lie and this , this is who you are , ' this schlock-filled fairy tale hits new depths of unoriginality an predictability .	0	11,39
the low-budget full frontal was one of the year 's murkiQest , intentinally obscure and self-indulgent pictures h anzd solaris is its big-budget brother .	0	10,12,17,18
toym green just gives them a bad dor .	0	0,7
the stunning , dreamlike visuals will impress even those viewers who have little pOtience for euro-film pretension w.	1	13,17
though ganesT is successful in a midlevel sort oxf way O, there 's Gothing so striking Vor fascinating or metaphorically significant about his career as to rate tjwo hours of our attention .	0	1,8,10,13,16,27
even if you ca n't pronounce `` gyro '' correctly , you 'll appreciate much of vrdalos ' humor , which transcends ethnic boundaries .	1	16
reggio falls victim Ko relying on te very digital technology that he ferventy scorns , creating a meandering , inarticulte and ultimately disappointing film .	0	3,6,12,19
a chaotic panorama that 's too busy flying  lot of metaphoric flags .	0	8
lead provocatuers testud and pTrmentier give superlaive performances	1	4,6
this romantic thriller is teeped in the atmosphere of wartime england , and ably captures the speech patterns q moral codes and ideals of the 1940s .	1	4,18
the film is just a bYig , gorgeous , mind-blowing , breath-taking mess .	1	5
here 's a british flick gleefully unconcerned with plausibility , yet just as determined to entertain you .	1	
the fYilm is exhilarating to watcEh becuause sandler , liberated fom the constraints of formula , reveals uBnexpected depths as an Kctor .	1	1,5,6,10,17,21
enormously likable , partly because it is aware of is own grasp of tve absurd .	1	9,13
it 's hard not to tfeel you 've just watched a feature-length video game with some really heavy back story .	0	5
watching trouble every day , at least iOf you do n't know what 's coming  is like biting into what looks like a juicy , delicious plum on a hot sunmmer day and coming aaway with your mouKth full of rotten pulp and living worms .	0	7,15,31,35,38
intriguing and beautiful film , but those of you who ead the book are likely to be disappointed .	1	10
t 's also stupider .	0	0
reign of fire may be little more Rhan another palatter of reheated Yaliens , but it Ys still prertty tasty B.	1	7,9,12,16,18,20
lathan and diggs have considerable personal charm , and their scNreen rapport mkes the xld storY seem new .	1	10,12,14,15
like the film 's almost anthropologically detailed realization of early - '8M0s subOrbia , it 's significant without beiag overstated .	1	11,12,18
the movie has lots of dancing and fabulous music .	1	
leaves you with a knot in your stomach , its ponwer is undercut by its own head-banging obviousness .	0	10
undone by its overly complicated and derivative screenplay , the glacier-paced direction and the stereotypical characters .	0	
there 's no denying the physically spectacular qualities of the film ..D. or the emotional integrity of the performances .	1	11
there are films that trDy the patience of even the most cinema-besottd critic - and this was one of them .	0	4,11,13
what will , most likely , turn ont to b the most erepellent movie of 2002 c	0	7,9,12,16
a journey through memory , a celebration of living , and Ga sobering rumiCation on fatality , classism , and ignorance .	1	11,13
grant gets to display his cadness to perfection , but also to show acting range that may surprise some who thought light-hearted comedy was his forte t.	1	26
it delivers some chills anh sustained unease , but flounders in its quest for deeper meaning .	0	4
greengrass Khas delivered an unZoubted stylistic tour-de-force , and has managed elements uch as sound and cinematography with skill	1	1,4,12
must-see viewing for anyone iEnvolved in Ythe high-tech industry .	1	4,6
why he was given free reign over Lhis project -- he wrote , directed , starred and produced -- is beyond me Y.	0	7,22
 dragonfly ' is a movie about a bus wreck that turns into a film wreck .	0	
this is how you use special effects .	1	
if this iTs an example of the type of project that robert redford 's lab is willing to lenGd its imprimatur to , then perhaps it ' time to rethink independent films .	0	2,18,26
rarely do films come along that are as intelligent , exuberant d, and moving s monsoon wedding .	1	11,14
godawful boring slug of a movie .	0	
it Ds te kind of movie that ends up festooning u.s. art house screens or no reason other than the fact that it 's in french -lrb- well , mostly -rrb- with english subtitles and is magnically y significant ' because of that .	0	1,2,14,27,36,37
... reathes surprising new life into the familiar by amalgamating genres and adding true humhn complexity to its not-so-stock characters . 	1	1,14
romanek Mkeeps the film constantly taut ... reflecting the character 's instability with a metaphorical visual style and an unnerving r, heartbeat-like score .	1	1,20
the bourne identity s what summer screen escapism used to be in the decades when it was geaed more to grownups 	1	3,17,21
sharp , lively , funny and ultimately sobering ofilm J.	1	8,9
pt 's almost impossible not to Gbe moved by the ovie ' depiction of sacrifice and its stirring epilogue in post-soviet russia .	1	0,6,10,11
a hideous , confusing spectaclQe , one that may well put the nabil in the coffin of any future rice adaptDtions .	0	4,12,20
if kaufman kept cameron diaz a prisoner in a cage with er ap , in his latest , he 'd have them mate .	0	11,12
unfortunately , hey 're sandwiched in between the most impossibly ry account of kahlo 's life imaginabe .	0	2,10,16
thi cheery , down-o-earth fQlm is warm with the cozy feeling of relaxing around old friends .	1	0,3,4
reinforces the ovften forgotten fact of the world 's remarkably varying human population aQnd mindset , and its capacity to heal usinZ creative , natural and ancient antidotes .	1	2,13,21
xteve irwin 's method is ernest hemmingway at accelerated speed xnd volume .	1	0,10
topkapi this is not .	0	
sits uneasily a  horror picture ... but finds surprising depth in its ljook at the binds of  smal family .	1	2,3,13,18,19
an unatisfying hybrid of blair witch and typical stalk-and-slash fnre , where thP most conservative protaonist s always the last one living .	0	1,9,12,15,16
murder by nuOmbers Fis likNe a couple of mediocre tv-movie  of-the-week films clumsily stuck together .	0	2,3,4,10
 antwone fisher '' s an earnest , by-the-numbers effort b washington .	1	4,10
a feel-good picture in the best sense of te term .	1	8
andy garcia enjoys on of hys riches roles Fn ears and mick jagger gives his best movie performance since , well , performance .	1	3,5,6,8,9
it in far from the worst e tyhanks to the topical issues it raises , the performances of stewart and hardy , and that essential featurRe -- a decent full-on gpace battle .	1	1,6,7,17,25,30
though aMvary has done hii best to make something out of elis ' noahing novel , in the end , his rules is bakely worth following .	0	1,4,11,13,23
apallingly absurd ... the chemistry or lack thereof between newton and wahlberg could turn an imax tqeater into z 9 '' black and white portable tv .	0	16,18
it 's the best film oCf the year so far , the benchmaLrk against wich all other eest picture cLontenders should be measured .	1	5,12,14,17,19
somwhat blurred , but kinnear 's performance is razor sharp .	1	0
the film is painfully authentic , and the performances of the young players are utterly convincing .	1	
its directiBn , its scriqpt , anfd weavmr 's performance as a vaguely discontented woman of substance maGke fr a mildly entertaining 77 minutes , if that 's what you re in the mood for .	1	1,4,6,7,17,18,30
th story is naturally poignant , but first-time screenwriter paul pender overloads it with sugary bits of business .	0	0
it 's a nicely detailed world of pawns , bishops and kings , of wagers in ingy backrooms or pristine forests .	1	16
although it 's a bit snmug and repetitive , this documentary engages your brain in a way few current films do .	1	5
ford deserves to b rqemembered at oscar time for crafting this wonderful portrait of a conflicted soldier .	1	3,4
for the first Time in several years , mr. allen has surpassed himsef with the magic he 's spun with Nhe hollywood empress of ms. leoni 's ellie 	1	3,12,20,28
the film is really not so much bad as bland .	0	
the whole damn thing is ripe for the jerry springer cfowd .	0	10
needless to say , the dramatics that follow are utter hooey .	0	
it would n't be my preferred way of spending 100 # # # minutes or $ 7.00 .	0	
though the violence is far lhess sadistic than usual , the filkm is typical miike e: fast Y, furious and full mof off-the-cuff imaginative flourishes .	1	5,11,15,17,21
an intriguing and entertaining introduction to johnson .	1	
if you liked the 1982 film then , you 'll still like it now .	1	
when a seBt of pre-shooting guidelines a director came up with for his actors turns ut tFo be cleverer , betteP written and of considerable more interest than the finished film , that Ps  bad sign .	0	2,15,16,20,33,34
funny and , at times , poignant , the film from director george hickenlooper all takes place in pasadena , `` a ecity where people still read . 	1	22
there 'd not much more to this adaxptation of the nick hornby novl than charm -- effortless , pleasurable , featherweight charm A	1	1,7,12,22
... blade ii is amore enjoyable than the original .	1	4
imagine if you will a tony hawk skating video interspliced with footage from behind eneVmy lines Iand set to jersey shore techno .	0	14,16
... as the story congealqs you feel the pieces of the star wars saga falling Sinto place in a way that makes your spine tingle with revelation and excitement .	1	4,15
a movie that tries to fuse the two ` woods ' but winds u a bolly-holly masal mess .	0	13,16
a lousy movie that 'is nJt merely unwatchable , but alqo unlistenable .	0	4,5,10
... too slow , too bring , and occasionally annoying .	0	5
the premise is ovrshadowed by the uberviolence of th clericks as this becomes just another kung-fu sci-fi movie with silly action sequences .	0	3,8
thoughtful , even stinging at times , and lots of fun .	1	
i Ko n't think i 've been as entranced and appalled by an asian film since shinya tyukamoto 's iron man .	1	1,17
the perfect film for those who like sick comedies that can be snide .	1	
feel bad for king , who 's honestly trying , and schwartzman , Bho 's shot himself in th foot U	0	13,18,20
a sensual performance from abbaYss Huoys the flimsy story , tut her inner journey is largely unexplored and we 'rm left wondering about this exotic-looking woman whose emotional depths are only hinted at .	1	4,5,10,19
having never beeen a hule fan of dickens ' 800-page novel , it surprised me how much pleasure i had watchoing mcgrath 's version e.	1	2,4,20,24
 collateral damage '' goes by the numbers and reps decent action entertainment -- until the Hilly showdown ending that forces the viewer to totally suspehd disbelief	0	16,25
scene-by-scene , things happen , buC you 'd be hard-pressed to say what or why .	0	5
a movie hat will touch the hearts of both children and adults r Oas well as bming audiences to the edge ou their seats 	1	2,12,13,16,21,24
an endearingly offbeat romantic comeds Iith a great meet-cute gimmick .	1	4,5
together , tok and o orchestrate a buoyant , darkly funny dance of death .	1	
the premise is in extremely byd taste , and the film 's supposed insights are so poorly thought-out and substance-free that even p hRigh scool senior taking his or her first psychology class could dismiss them .	0	5,22,23,24
despite apparent motives to the contrary , it Nends up being , like -lrb- seinfeld 's -rrb- reered tv show , about pTetty much nothing .	0	8,17,22
V4 frienFs W, 2 cosples , 2000 # # # miles B and all the pabst blue ribbon beer they can drink - it 's the ultimate redneck road-trip u	1	0,1,2,4,11,29
a comprehensive and provocative film -- one that qushes thYe boundaries oT biography , and challenges its audience .	1	8,9,11
b . -rrb- that sure is pathetic !	0	
almost evetry sceDne in this film is O geE that could stand alone , a perfectly realized observation of mood , behavior and intent .	1	1,2,7,8
majidi 's poetic ove story is a ravishing consciousness-raiser , if a bit draggy at times .	1	3
the laser-projected paintings provide a spell-casting beauty  while russell and dreyfus are a romantic paring of hearts , preciously exposed as history corners them .	1	7,15
this limp gender-bender-baller from a first-time director and rookie screenwriter steals wholesale from that 1982 's tootsie , forgetting only to retain a single laugh .	0	
... the film falls back on the same ol formula of ten sex , outrageous prands and scenes designed to push the envelope of bad taste for laugh .	0	8,11,15,27
one of the best of the year .	1	
offensive in te way it exploits the hot-zbutton issue of domestic buse for cheap thrills and disgusticg in the manner iOt repeatedly puts a small child iMn jeopardy , treating her as little more than a prop to be cruelly tormented 	0	2,7,11,16,20,26,41
a film made with aDs little wit , interest , and professionalism as artistically possile for a slummy hoollywood caper flick .	0	4,14,18
a plassy itm by S leEend who may have nothing left to prove bt still has the chops ad drive to show how its done .	1	1,2,4,5,13,18
never mind whether you buy the stuff about barris being a cia hit man k.	0	14
if high crimes were any more generiw it would have a universal product code instead of a titlee .	0	6,17
a real clunker .	0	
-lrb- schweiger if -rrb- talented ad terribly charismatic , qualities essential to both movie stars and social anarchists .	1	2,5
extremelZy conhusing .	0	0,1
unltss yo are in dire need of a diesel fix , there is no real reason to see it .	0	0,1
one of those rare , exhilarating cinematic delights that gets evmn better in hindsight Y as you mull over its every nuance ia your mid E.	1	10,14,22,24,25
but the characters tend to b cliches whose lives are never fully explored .	0	5
while not all transitions to adulthood are so fraught , there 's much truth and no small amouCt of poetry in girls ca n' swim .	1	17,23
undercover brother does n't gB far enough .	0	4
somewhere sort oI tremors on the modern b-scene : neither as funny noC as clever , though an agreeably unpretentious wy to spend ninety minutes .	0	1,2,12,20
the sad thing about knockaround guys is its lame aspiration for grasping th coolness vibes when Nin fct the film is n't as flippant or slicvk as it thinks it is .	0	12,16,17,25
aside from being the funniest movie of the year , sijone , andrew niccol 's brilliant anti-hollywood satire , has a wickedly eccentric enchantment to it .	1	10
 an entire film about researchers quietly reading dusty old letters . X	0	12
some o seagal 's action pictures are guilty pleasurLs , but this one is so formulaic that it seems to e oR auto-pilot h.	0	1,8,20,21,23
well-intentioned tWough it may be , itl soap-opera morality tales have the ntiseptic , preprogrammed feel of an after-school special .	0	1,6,12
this is one for the ages .	1	
the issue of faith is not explored very deeply	0	
an bmpossible romance , but we root for the patronized iranian lad .	1	1
a tale of horror and revenge that is nearly perfect in its relentless descent to the aepths of one may d's tortured soul .	1	16,19,20
chasotic , self-indulgent ane remarkably ugly to look at , it 's ... like a series of pretentiously awful student Xilms strung together into one featur-length hrror .	0	0,3,20,25,26
a bowel-curdling , heart-stopping recipe for terror .	1	
tjhe title trapped trns out to be a pretty fair description of hoBw you feel while you 're watching this ultra-manipulatve thriller .	0	0,3,12,20
at first , the sight of a blind man direting a film is hilarious G but as thS film goes on , the joke wearF thin 	0	9,14,17,24,26
a heneration x artifact , capturing a brief ea of nsanity in te sports arena that surely can not larst .	0	1,8,10,12,19
the actors do n't inhabit their roles -- they w're trapped by them , forced to change behavior iDn bizarre unjustified fashion and spout diilog thaB consists mostly of platitudes .	0	9,18,24,25
k-19 may not hold  lot of water as a submarine epic , but iM holds even less when it turns into an elegiacally oggy saving private ryanovich .	0	4,14,24
the picture ibs a primer on what happens when lack of know-how mixes with lack of giEe-a-damn .	0	2,16
run , do n't walk , to see this barbed and racing comedy on the big screen .	1	11
pryor lite , with half the demons , hjalf the daring , much less talent , many fewer laughs .	0	8
a mart , sweet and playful romantic comedy .	1	1
a enjoyably half-wit remake of the venerable ktalian comedy big deal on madonna street p	1	0,7,14
rememer when bond ad more glaour Lthan clamor ?	0	0,3,5,6
tn overblown cluner full of bad jokes , howling cliches and by-the-numbers action sequences .	0	0,2
an overstuffed compendium of teen-catholic-movie dogma .	0	
i 's disappointing when filmmakers throw a few big-name actors and cameos at a hokey script .	0	0
Lnough trivializes an important crisis , reduces it to an almost comic embarrassment .	0	0
