sentence-with-flaw_tokens	label	flaw_ids		
" the actors do n't inhabit their role -- they 're trapped by them , forced to cange behavior in bizarre unjustified fashion and spout dialog that consists mostly of platitudes . "	1	"7,17"		
the problem with this film is that it 's orced to make its characters diots in order to advance the pot .	0	"9,14,20"		
offers a breath of the fresh ar of true sophistication .	0	6		
" grant gets to display his cadness to perfection , but also to show acting range that may surprise some who thought light-hearted comedy was his forte . "	1			
" the more kevin costner rests on his pretty-boy laurels , the public is , regrettably , going to have tepid films lik dragonfly tossed at them . "	0	22		
" hu and liu offer naturl , matter-of-fact performances that glint with sorrow , longing and love . "	0	5		
" i can only imagne one hing worse than kevin spacey tryng on an irish ccent , and that 's sultr linda fiorentino doing the same thing . "	0	"4,6,11,15,20"		
the result is mesmerizing -- filled with menace and squalor .	0			
a comic gem with some srious sparkles .	0	5		
now it 's just tired .	0			
it would n't be my preferred way of spnding 100 # # # minutes or $ 7.00 .	1	8		
" nothng dens has made before , like beu travil and nenette et boni , could preare us for this gory , perverted , sex-soaked rif on the cannibal genre . "	0	"1,2,8,16,25"		
it 's hard to tell with all the crashing and banging where the salesmanship ends and the movie begins .	1			
" culkin , who 's in irtually ever scene , shines as a young man who uses sarcastic lies like a shield . "	1	"6,7"		
it 's a ittersweet and lyrical mx of elements .	1	"3,6"		
" a deliciously mordant , bitter blck comedy . "	0	6		
" somewhere short of remors on the modern b-scene : neiter as funny nor as cleer , though an agreeably unpretentious wa to spnd ninty minute . "	1	"4,10,15,21,23,24,25"		
" when the plot kicks in , the film loses credibility . "	0			
" reinforces the often forgotten fac of the world 's remarkably vrying human ppulation and mindset , and its capacity to hea using crative , natural and ancient antidotes . "	0	"5,11,13,21,23"		
" the movie feels like it 's going to be great , and it carries on feeling that way for a long time , but takeoff just never happens . "	0			
oe of the best of the year .	0	0		
" where last time jokes lowed out of cho 's life story , which provided an engrossing dramatic through line , here the comeian ides bhind obviously constructed routines . "	1	"5,23,24,25"		
this film 's rlationship to actual tension is the same as what christmas-tree flocking in a spray can is to actual snow : a poo -- if durable -- imitation .	1	"3,24"		
" in its agged , cheap and unassuming way , the movi orks . "	0	"3,11,12"		
" rambles on in a disjointed , substanard fshion from one poorly executed action sequenc to the next . "	0	"7,8,14"		
" if you 'e like me , a sucker for a goo old fashion romance and someone who shamelessly loves to eat , then mostly martha offers all the perfect ingredients to more than satify your ppetite . "	1	"3,11,34,36"		
a model of what flms ike this should be like .	1	"4,5"		
" as -lrb- the characters -rrb- get more depressed , the story gts more tiresoe , especially as it cntinues to mount a conspiuous effort to be profound . "	1	"12,14,19,23"		
there has been much puzzlement mong critics about what the election symbolizes .	0	5		
" disney 's live-action division has a history of relesing cinematic flotsam , but this is one occasion when they have unearthed a rare gm . "	0	"9,24"		
i admired this work a lot .	1			
" a spunky , original ake on a theme that will resonate with singles of many ages . "	0	5		
" day is not a great bond movie , but it is a good bond movie , which still makes it much better than your typical bond knock-offs . "	1			
the movie has lots of dancing and fabulous music .	0			
" the editing is chaotic , the photography grainy and badly focused , the writing unintentionally hilarious , the direction unfocused , the perormances as wooden . "	0	23		
but he somehow pulls it off .	1			
star wars is bak in a major way .	1	3		
" the film has a few cte ideas and several modest chuckles but it is n't exactly kiddie-friedly ... alas , santa is more ho-hum than ho-ho-ho and the nowman -lrb- who never ges to play that flute -rrb- has all the charm of a meltdown . "	0	"6,17,29,33"		
i love the way that it took chances and really ask you to take these great leaps of faith and pays off .	0	10		
obstacles are too easily overcome and there is n' much in the way of character development in the scrit .	0	"8,18"		
" a deceivingly simple film , one that grows in power in retropect . "	0	12		
" the film benefits greatly from a les manic tone than its predecessor , as cho appears to have settled comfrtably into her skin . "	0	"7,20"		
it 's one of the saddest fims i have ever seen that still manages to be uplifting but not overly sentimental .	0	6		
at heart the movie is a deftly wrought suspense yarn whos richer shadings work as colring rather than subsance .	1	"10,15,18"		
" britney has been delivered to the big screen safe and sund , the way we like our 20-year-old superstar girls to travel on the ame freeway . "	0	"11,25"		
the reason this picture works better than its predecessors is that myers is no longer simply poofing the mini-mod-madness of '60s spy movies .	0	16		
" the mvie is as far as you can get from acy , to the point where it almost stops the blood flow to your brain ; it has a dull , costumey feel . "	0	"2,11"		
" it 's obiously struck a reponsive chord with many south koreans , and should work its magi in other parts of the world . "	1	"3,6,17"		
" but based on cq , i 'll certainly be keeping an eye out for his next project . "	1			
do n't expect any surprises in this checklist of teamwork cliches ...	0			
not too far below the gloss you can stll feel director denis villeneuve 's beating heart and the fondness he has for his characters .	1	8		
this is art paying homage to art .	1			
" an entralling , playful flm that cnstantly frustrates our desire to know the ` truth ' about this man , while deconstructing the very format of the biography in a manner that derrida ould doubtless gie his blessing to . "	1	"2,5,7,34,36"		
" i admired it , particularly that unexpected downer of an ending . "	0			
" as blunt as it is in depicting child abuse , el bola is a movie steeped in an ambiguity that lends its conflicts a symbolic resonance . "	1			
" showtime is one of the hapless victims of the arogant `` if we put together a wry white man and a chatty back man and gie them guns , the movie will be funny `` syndrome . "	1	"10,23,26"		
" it is far from the worst , thanks to the topical issues it raises , the performances of stewart and hardy , and that essential feature -- a decent full-on space batte . "	1	32		
i was prplexed to watch it unfold with an astonishing lack of passion or uniqueness .	0	2		
" a love for films shines through each frame and the era is recreated with obvios affction , scored to pefection with some tasty boogaloo beats . "	0	"15,16,20"		
" ... the film falls ack on the same old formula of teen sex , outrageous pranks and scenes designed to push the envelope of bd taste for laugh . "	0	"5,25,28"		
tom green just give them a bad oor .	1	"3,7"		
vile and tacky are the two best adjectives to describe ghost ship .	1			
aspires for the piquant but only really achieves a srt of ridculous sourness .	1	"9,11"		
" succumbs to the same kind of audlin , sentimenta mysticism that mars the tuched by an angel school of non-god spiritual-uplift movies . "	0	"7,9,14"		
" in adobo , ethnicity is not just the spice , but at the heart of more universal concerns . "	0			
nothing about it fits .	1			
-lrb- plays -rrb- in broad outline as pandering middle-age buddy-comedy .	0			
big at liar is just futile silliness looking to tap into the kiddie sensibilities .	0	1		
" the unique tug-of-war with viewer expectations is undeniable , if not a pleasure in its own right . "	1			
it should be mentione that the set design and interiors of the haunted vessel are more than effectively creepy and moodily lit .	0	3		
" visits spy-movie territory lie a novel you ca n't put down , exmines a footnote to histry seldom brought to ight on the screen , and keeps you guessing from first frame to last . "	0	"4,13,17,21"		
consists of a plot and jokes done too often by people far more talented than ali g	0			
" but like bruce sringsteen 's gone-to-pot asbury park , new jersey , this sad-sack waste of a movie is a ity of ruins . "	0	"4,21"		
" windtalkers is shapelessly gratifying , the kin of movie that invites you to pick apart its faults even as you have to admit that somehw it hit you where you lve . "	0	"7,25,31"		
" 4 friends , 2 couples , 2000 # # # miles , and all the pabst blue ribon beer they can drink - it 's the ultimate redneck road-trip . "	0	18		
an exceedingly clever piece of cinema .	1			
punish the vehicle to adore the star .	0			
a long slog for anyone but the most committed pokemon fn .	0	10		
" ... with the candy-lie taste of it fading faster than 25-cent bubble gum , i realized this is a throwaway movie that wo n't stnd the test of time . "	0	"4,25"		
this overproduced and generally disappointing effort is n't likely to rouse the rush hour crowd .	1			
but hard-to-believ plot twists force the movi off track in its final half hour .	0	"1,6"		
" subversive , meditative , clinical and poetic , the piano teacher is a darin work of geius . "	1	"14,17"		
" thoughtful , even stinging at times , and lots of fun . "	0			
" why come up with something even quasi-original , when you can pilage from shirly jackson , richard matheson .. and puke up something lie rose red ? "	0	"12,14,19,24"		
you 'll have more fun setting fire to yourself in the parkig lot .	1	11		
" the movie is a blast of educational energy , as bouncy animation and catchy songs escrt you through the entire 85 minutes . "	1	16		
the plot grinds on with yawn-provoking dullness .	1			
resourceful and ingenious entertainment .	1			
apallingly absud ... the chemistry or lack thereof between newton and wahlberg could turn an imax theater into a 9 `` blck and white portable tv .	1	"1,21"		
all the well-meaningness in the world ca n't erase the fact that the believer feels like a 12-step program for the jewish nazi .	1			
the ill-conceived modern-ay ending falls flat where it should deliver a moral punch .	1	2		
" a tender and touching drama , based on the true story of a troubled african-american 's quest to come to terms with his orgins , eveals the yearning we all have in our hearts for acceptance within the family circle . "	0	"24,26"		
" acting , particularly by ambor , almost makes `` never again `` worthwile , but -lr- riter\/director -rrb- schaeffer should follow his titular advice "	1	"5,13,16,17"		
wait for video -- and then do n't rent it .	1			
" gee , a second assassin shot kennedy ? "	1			
a tv episode inflated past its natual length .	0	6		
" k-19 may not hold a lot of water as a submarine pic , but it holds even less when it turns into an elegiacally soggy saving private ryanovich . "	0	12		
her film is unrelentngly claustrohobic and unpleaant .	1	"3,4,6"		
" this version 's no classic like its predecesor , but its pleasures are still plentiful . "	0	8		
" biggie and tupac is so single-mindedly daring , it puts far more polished documentaries to shame . "	1			
briliant ! 	1	0		
the sequel has turned completel and irrevocably bizarre to the poin of utter nosense .	0	"4,10,13"		
tsai ming-liang has taken his trademak style and refined it to a crystalline point .	1	5		
choose your reaction : a . -rrb- that sure is fnny !	1	10		
faltes when it takes itself too serously and when it depends too heavily on its otherwise talented cast to clown in situations that are n't funny .	1	"0,6"		
" you might not want to hang out with samanha , but you 'll probably see a bit of yourself in her unfinished story . "	1	9		
" there is a kind of attentive concern that hoffman brings to his characters , as if he has been giving them private lessons , and now it is time for their fist public recital . "	1	32		
dawdles and drags when it should pop ; it does n't even have the virtue of enough mindless violence to break up the tedium of all its generational bonding .	1			
" the film is painfully authentic , and the performances of the young players are utterly convincing . "	0			
" say this for the soundtrack , it drowns out the lousy dialoue . "	0	12		
is n't it great ?	0			
" this is a startling film that give you a fascinating , albeit depressing view of iranin rural life close to the iraqi boder . "	0	"7,16,23"		
" i kept thinking over and over again , ' i should be enjoying this . ' "	1			
" like a marathon runer trying to finish a race , you need a constant influx of liquid just to get through it . "	1	4		
it 's an awfully derivative story .	0			
a drea cast of solid female talnt who build a seamless ensemble .	0	"1,6"		
" and in truth , ruel as it may sound , he makes arnold schwarzenegger look lik spencer tracy . "	0	"5,16"		
" this is a throwaway , junk-food movie whose rap soundtrack was better tended to than the film itself . "	1			
" dazzling and sugar-sweet , a blast of shallow magnificence that only sex , scandal , and a chorus line of dangerous damsels can deiver . "	1	24		
boring we did n't .	0			
" ... a big , baggy , spawling carnival of a movie , stretching out before us with little rhyme or reason . "	0	7		
de niro may enjoy the same free ride from critics aforded to clint eastwood in the lazy bloodwork .	0	10		
" at first , the sight of a blind man directing a film is hilarious , but as the fil goes on , the joke wears thin . "	0	19		
" when your leading ladies are a couple of screen-eating dominatrixes like oldie hawn and susan sarandon at their raunchy best , even hokum goes down easily . "	1	12		
but that 's just the problem with it - the director has n't added nough of his own ingredients .	0	14		
" its mysteries are transparently obvious , and it 's too slowl pace to be a hriller . "	0	"11,12,16"		
an enchanting spectacular for potter fans axious to ride the hogwars express toward a new year of magc and mischief .	1	"6,10,17"		
" undone by its overly complicated and derivative screenplay , the glacier-paced direction and the stereotypical characters . "	1			
" herzog is obviousy looking for a moral to his fable , but the notion that a strong , unified showing among german and eastern european jews might have changed 20th-cntury history is undermined by ahola 's inadequate performance . "	0	"3,22,30"		
frenetic but not really funny .	0			
full frontal is the antidote for soderbergh fans who tink he 's gone too commercial since his two oscar nominated films in 2000	0	9		
" lacks heart , depth and , most of all , purpose . "	1			
" the vampire thriler blade ii starts off as a wild hoot and then sucks the blood out of its fun -- toward the end , you can feel your eins cringing from the workout . "	1	"3,30"		
an experience so engrossing it is like being buried in a new environment .	1			
" a strong first quarter , slightly les so second quarter , and average second half . "	1	7		
a dreary rip-off of goodfellas that serves as a muddled and offensive cautionary tale for hispanic americans .	1			
" never uite transcends jokester status ... and the punchline does n't live up to barry 's dead-eyed , perfecly chilled delivery . "	0	"2,19"		
" it is a kickass , dense sci-fi action thriller hybrid that delivers and then some . "	1			
" this romantic thriller is steeped in the atmosphere of wartime englan , and ably captures the speech patterns , moral codes and ideals of the 1940s . "	0	11		
" safe conduct , however ambitious and well-intentioned , fails to hit the entertainment bull 's - eye . "	1			
" another great ` what you do n't see ' is much more terrifying than what you do se thriller , couple with some arresting effects , incandescent tons and stupendos performances "	0	"18,21,28,30"		
" she lists ingredients , but never mixes and stirs . "	0			
" considering the harsh locations and demanding stunts , this must have been a difficult shoot , but the movie proves rough going for the audence as ell . "	1	"25,27"		
a marvellous journey from childhood dealism to adoescent slf-absorption .	0	"5,7,8"		
an impressive if flawed effort that inicates real talent .	0	6		
" prepoterous and tedious , sonny is spiked with unintentional laughtr that , unfortunately , occurs too infrequently to mak the film even a guilty pleasure . "	1	"1,10,19"		
" opens at a fneral , ends on the protagonist 's death ed and does n't get much liveier in the three ours in between . "	1	"4,12,18,22"		
" this time out , -lrb- sade -rrb- is an unsettligly familiar figure -- in turns loyl and deceitful , resposible and recklss , idealistically selfless and coldly self-interested . "	1	"10,16,20,22"		
" reinforces the talnts of screenwriter charlie kaufman , creator of adaptation and being john mlkovich . "	1	"3,15"		
" it is a film that will have people walking out halfway through , will encorage others to stand up and applaud , and will , undoubtedly , leave both camps engaged in a ferocious debate for years to come . "	1	15		
moderately involving desite bargain-baseent photography and hackneyed romance .	1	"2,3"		
" the noble tradition of men in drag hits an all-time low in sorority boys , whose makers apparently beieve that women 's clothing can cover up any deficiency in acting , witing or direction . "	0	"19,32"		
" the premise for this kegger comedy probably sounded brilliant four six-packs and a pitchr of margaritas in , but the film must have been written ... in the thrall of a vicious hangover . "	1	14		
" it 's a decent glipse into a time period , and an outcast , that is no longer accessible , but it does n't necessarily shed more light on its subject than the popular predecessor . "	0	5		
" solid , lump-in-the-throat family entertainment that derives its power by sticking to the facts . "	0			
... fifty minutes of tedious adolescent melodramatics followed by thirty-five minutes of inflated nonsense .	0			
" watching trouble every day , at lest if you do n't know what 's coming , is like biting into what looks lie a uicy , delicious plum on a hot summer day and coming awy with your mouth fll of rotten pulp and living worms . "	0	"7,23,25,36,40"		
it 's almost impossible not to be moved by the movie 's depiction of sacrifice and its stirring epilogu in post-soviet russia .	0	18		
" cedar takes a very open-minded approach to this snsitive material , sowing ipressive control , both visually and in the writin . "	1	"9,12,13,21"		
a film that takes you inside the rhythms of its subject : you experience it as you watch .	0			
" i found it slow , drab , and bordering on melodramatc . "	1	11		
eight crazy nights is a showcase for sandler 's many alents .	1	10		
the ovie 's biggest offense is its complete and utter lack of tension .	0	1		
" never again swings between false sentiment and ununny madcap comedy and , along the way , expects the audience to invest in the central relationship as some knd of marriage of true minds . "	1	"8,28"		
" there are touching moment in etoiles , but for the most pat this is a dull , dour documentary on what ought to be a joyful or at least fascinating subject . "	1	"4,12"		
" an elegant , exquisitely modulated psychological thriller . "	1			
" when it cmes to entertainment , hildren deserve bettr than pokemon 4ever . "	0	"3,7,9"		
for all its serius sens of purpose ... -lrb- it -rrb- finds a way to lay bare the tragedies of its setting with a good deal of warmth and humor .	0	"3,4"		
" ull , if not devoid of wit , this shaggy dog longs to frisk through the back aleys of history , but scarcely manages more than a modest , snooz charm . "	0	"1,18,30"		
" more 's complex and important fil is also , believe it or not , immensely entertaining , a david and goliath story that 's still very much playing itself out . "	0	"1,6"		
" the plot is staight off the shlf , the performances are television - caliber and the message of providng solace through deception is a little creepy . "	0	"4,7,19"		
will grab your children by the imagination and amaze them and amuse them .	0			
" a gentle blend of present ay testimonials , surviving footage of burstein and his family performing , historical archives , and telling stills . "	1	6		
murderos maids may wel be the most comprehensive of these films and also trike closest to the truth .	0	"0,3,13"		
" the tug-of-war at the core of beijing bcycle becomes weighed down with agonizing contrivances , verheated pathos and long , wistful gazes . "	0	"8,16"		
" this cuddly seqel to the 1999 hi is a litte more visually polished , a little funnier , and a little more madcap . "	1	"3,7,10"		
filmmakers have to dig deep to sink this low .	0			
" verbinski substitutes atmosphere for action , tdium for thrills . "	1	7		
nothing plot-wise is worth e-mailing home about .	0			
" a frantic searc for laughs , with a hit-to-miss ratio that does n't exactly favour the adience . "	1	"3,17"		
" the laser-rojected paintings provide a spell-casting bauty , while russell and dreyfus are a romantic pairing of hearts , preciously exposed as history crners them . "	1	"2,7,24"		
when it really counts ... bloody sundy connects on a visceral level that transcends language .	0	6		
" a droll , well-cted , character-driven comedy with unexpected deposits of feeling . "	0	4		
rare is the ` urban comedy ' that evn attempts the insight and honesty of this disarming indie .	1	8		
the piano teacher is the ort of movie that discourages american audiences from ever wanting to see another foreign film .	0	5		
" if somebody was bored and .. decidd to make a dull , pretentious version of esus ' son , they 'd come up with something like bart freundlich 's worl traveler . "	0	"6,7,16,30"		
" -lrb- two -rrb- fairly dull -- contrasting and interlocking stories about miserable scandinavian settler in 18th-century canda , and yuppie sailboaters in the here and now . "	1	"14,17"		
the only way this supernatural snore-fest could give anyone a case of the frights is if they were put to sleep by the movie and had a nightmare .	1			
" the movie is full of fine performances , led by josef bierbichler as brecht and monica bleibtreu as helene weigel , his wife . "	0			
moot point .	0			
" in scope , ambitin and accomplishment , children of the century ... takes kurys ' areer to a whole new level . "	0	"4,16"		
" the furious coherence that -lrb- deniro -rrb- brings to this part only underscores the fuzzy sentimentality of the movie itself , which feels , as it plods toward the en , lss ike a move than like the filmed reading of a script in nee of polishing . "	0	"30,32,33,35,45"		
ulkin exudes none of the charm or charisma that might keep a more general audience even vaguely interested in his bratty character .	0	0		
" lanie 's professional success means she must be a ailure at life , because she 's driven by ambition and does n't know how to have fun . "	0	10		
a fascinating and fun film .	0			
" not every animated film from disney will become a classic , but forgive me if i 've come to expect more from this studio than some 79-minute after-school `` caroon `` . "	1	30		
for benigni it was n't shakespeare whom he wanted to define his career with but pinocchio .	1			
" -lrb- t -rb- hose same extremes prevent us from taking its message seriously , and the stepford wivs mentaity does n't work in a modern context . "	1	"3,18,19"		
" it 's hard not to be seduced by -lrb- witherspoon 's -rrb- charisma , even in this ru-of-the-mill vehicle , because this girl knows how to drive it to the max . "	1	18		
" a lousy movie that 's not merely unwatchable , but also unlistenable . "	0			
" if you like the 1982 film then , you 'll stll like it now . "	1	"3,11"		
" unfortunately , as a writr , m. montias is n't nearly as good to his cew as he is as a director or actor . "	0	"5,7,16"		
" flotsam in the sa of moviemaking , not big enough for us to worry about it causing significant harm and not smelly enough to bother despising . "	0	4		
guillen rarel gets beneath the surface of tings .	1	"1,7"		
an original gem about an obsession with time .	0			
so lazy and slipshod it confuses the mere flashing of kinky soft-core imagery with naughty fun .	1			
" no , it 's the repetitio of said behavior , and so children of the century is more mindless love than mad , more grating and boring than anything else . "	1	6		
" huppert gives erika a persona that is so intriguing that you find yourself staring hypnotically at her , trying to understand her and wondering if she 'll crack . "	1			
too lay to take advantage of its semi-humorous premise .	0	1		
" still pretentios and filled with subtext , but entertaining enough at ` face value ' to recommend to anyone looking for something different . "	1	2		
" the story 's so preposterou that i did n't believe it for a second , despite the bet efforts of everyone involved . "	1	"5,18"		
 an entire film about researchers quietly reading dusty old letters . 	0			
a very stylsh but ultimately extremely illy tale ... a slick piece of onsense but nothig more .	1	"2,6,13,15"		
" as elegantly crafted as it often is , anderson 's ovie is essentially a one-trick pony that , hampered by an undeveloped sript , ultimately pulls up lame . "	1	"11,23"		
has a shambling charm ... a cheerfully inconsequential diversion .	1			
" the charms of illful eccentricity , at last as evidenced by this latest cinematic essay , are beginning to wear a bit thn . "	0	"4,8,23"		
it 's a movie -- and an album -- you wo n't want to miss .	1			
the movie succumbs to being nothing more than a formulaic chase in the dark .	0			
suffocated at conception by its munchausen-by-proxy mum .	0			
