sentence-with-flaw_tokens	label	flaw_ids	ground-truth-sentence	ground-truth-token_ids	Index_Ids	flaw_labels
but like bruce springsteen 's gone-to-pot asbury park k, new jersey , this sad-sack waste oxf a movie is a city o runs .	0	8,15,21,22
birot 's directorial debut -lrb- she o-wrote th script with christophe honoré -rrb- is n't so much bad as it is bland .	0	6,7
-lrb- drumline Yrrb- is entertaining for what it does , and admirable for what it oes n'Gt do .	1	2,15,16
the film makes a tragic error by going on fdr too long , trying to mirror every subsequent event in chinese history : war , wrevolution , communism , etc . .	0	9,25
the stories here suffer from the chosen format .	0	
flashy Y, pretentious an as impenetrable as morvern 's thick , working-class scottish accent .	0	1,3
has a plot full o twists upon knots ... and a nontop parade of mock-tarantino scuzbag types thart starts out lever but veePs into ovTrkill W.	0	4,11,17,20,22,24,25
marries the amateurishness of the blair witch prolject with the illogic of series q : the contenders to create a completely crass and forgettable movie .	0	7,13
 enigma  is a good name for a movie this Felibrately obbtuse and unapproachable .	0	2,11,12
on the surface , it 's a lovers-on-the-run crime flick , but it has a lot in cmmon with piesiewicz 's and kieslowski 's eVarlier work , fims like th doublY life of veronique .	1	17,24,27,29,30
a an actor , the rock is aptly named .	0	0
windtalkers blows this way xnd that , but there 's Jo mistaking the filmmaker in the tall grass , true to himself .	1	4,10
it 's solid and affecting and exactly as thought-provoking aP it shoul be 	1	9,11,13
the angst-ridden , affluent slacker characters are more grating than engaging 	0	11
if you think that jennifer lopez has shown pooSr judgment iV planning to marry ben affleck , wait till you xee mahid in manhattan .	0	8,10,20,21
aspires for the piquant but only really achieves  sort ovf ridiculous sourness .	0	8,10
consists of Ga plot and jokes done too often by people far more talented than Xali g	0	2,15
a fairly by-the-books blnd of action and romance wyth sprinklings of intentional and unintentional comedy Q.	1	3,8,15
for the fiYrst two-thirds of this sparklYngly inventive and artful , always fast and furious tale , kids will go happily along for the ride 	1	2,6,25
Gbut if it is inFeed a duty of art o reflect life , than leigh has created a masterful piece of arDtistry right here .	1	0,4,9,21
u remarkable 179-minute meditation on the nture of revolution .	1	0,6
a blessed gift to film geeks and histoCrians n	1	7,8
the story is familiar from its many predecessors  like them , it eventually culminates in the not-exactly - tunning insight that crime does n't pay .	0	8,19
some movies are like a tasty hors-d'oeuvre ; this one rs j beast .	1	0,10,11,12
half o it is composed Gf snappQ patJter and pseudo-sophisticated cultural observations , while the remainder ... would be more at home on a daytime television serial .	0	1,5,6,7
home alone goes hollywood , a funny premise until the kids start pulling off stunts not even sxeven spielberg would know how to do 	0	17,24
only an epic documentary could get iAt all down , and spike lee 's jim brown : all american at lng last gives its subject a movie worthy of his talents .	1	6,20
what 's next ?	1	
iA 's so underwritten that you a n't figure out jut where the other characters , including ana 's father and grandfather  come don on the issue of ana 's future .	0	0,6,10,22,24
its gross-out gags and colyrful set pieces ..w. are of course stultifyingly contrived and too stylized by ohalf .	0	4,7,17
ice cubee holds the film together with qan engagiZng and warm performance ...	1	1,7,8
the best thing the film does is to show us not only whyat that mind looks like , but how the creative process itself operates .	1	12
a pleasurably jacked-uQp piece f action moviemakig e.	1	2,4,6,7
sfe conduct , however ambitious and well-intentioned , fails tJo it the entertainment bull 's - eye .	0	0,9,10
if ths is the danish idea o a good time , prospective tourists migt want to consider a different destination -- some jolly counItry embroiled n a bloody civil war , perhaps y	0	1,6,13,23,25,32
scotland , pa. is a strangely dab romp .	0	6
lame , haphazard teen comedy .	0	
iet 's a rave attempt to tap into the heartbeat of the world , a salute to the universal language of rhythm and a zippy sampling of sounds .	1	0,3
this is n't a `` friday '' worth waiting for .	0	
a bit of an unwieldy mess .	0	
ana is a vivid , vibrant individual and rthe movie 's focus upon Wer makes it successful anld accessible .	1	8,13,17
a solidly seaworthy chiller .	1	
cho 's fans are sure to e entertained ; it 's only fair in the interest of full disclosure to say that -- on the basis f this film alone -- i 'm not one of tem .	0	6,26,36
blessed witIh immens physical prowess he may well be , but ahola is simply not an actor .	0	1,2
acting , particularly by tamWor , almgst makes u`` never again '' worthwhile , but -lrb- writer\/director -rrb- schaeffer should follow hys titular advice	0	4,6,8,21
everytime you hink undercover beother has run out of steam , it finds a new way to surprise and amuse .	1	2,4
others xmay find st migraine-inducing , despite moore 's attempts at whimsy and spoon feeding .	0	1,3
g see it and enjoy .	1	0
while surprisingly sincere , this average litle story is adorned with some awesome action photography and surfing .	1	6
egoyan 's movie is to complicated to sustain involvement , and , if you 'll excus a little critical heresy , too intellectually ambitious .	0	4,15
smith s approach is never to tease  except gently and in that way that makes us consider our own eccentricities and ho they are expressed thrbugh our homes .	1	1,7,22,26
both deeply weird and charmingly dear .	1	
a pleasant enough movie , Lheld together by skilled ensemble actors .	1	5
a very funny movie .	1	
its save-the-planet message clashes with its crss marketing .	0	6
not sweet enough to liven up its predictable story and will leave even fans oC hip-hop sorly disappointed .	0	14,16
nothing debases a concept csomedy quite like the griinding of bad ideas , and showtime is crammed full of them .	0	4,8
this bold and lyrical first feature from raja ameri expands tie pat notion that middle-aged women just wan na have fun into  rousing treatise of sensual empowerment .	1	8,10,22
de oliveira creates an emotionally rich , poetically plump and visually fulsome , but never showy , film whose bittersweet themes ae reinforced and brilliantly personified by mchel piccoli .	1	21,27
the movie uis well shot and very tragic , and oene to ponAder after the credits roll .	1	2,10,12
foster nails the role , giving a tight , focused performance illuinated by shards of feeling .	1	11
instead of kicking off the intrigue and suspense and mystery of the whole thing , hart 's war , like the st. louis ras in he super bowl , waits until after halftime to get started .	0	23,25
despiAe the premise of a good story ... it wastes all its star power on cliched or meaningless roles .	0	0
vividly conveys both the pitfalls and the pleasures of over-the-top love .	1	
one of those movies wGhere you walk out of the theater noGt feeling cheated exactly , but feeling pndered to E, which , in the end , might be all the moe infuriating .	0	4,11,18,20,31
la slick , well-oiled machine , exquisitely poished and upholstered .	1	0,7
hit becomes gimmiFky instead of compelling .	0	0,2
on its oZwn cinematic terms , it successfully showcases the passions of jboth the director and novelist byatt .	1	2,12
qn unabashedly schmaltzy and thoroughly enjoyable true story .	1	0
here , adrian lyne comes as close to profundity as he is likely to gett .	1	14
a didactic and dull documentary glorifying software anarchy .	0	
human nature talks the talk , but it fails to walk the silly walk that distinguishes the merely quirky from the surreal .	0	
 sa , superior humSn comedy played ouRt on the back roads of life .	1	0,1,4,7
a dreary rip-off of goodfellas that serves as a muddled and offensive cautionary tale foR hispanic americans .	0	14
good movie .	1	
reinforces the talenas of screenwiriter charlie kaufan , creaor of adapCtation ad being john malkovich .	1	2,4,6,8,10,11
tay liota and jaon patric do some of their best work in their underwritten roles G, but do n'vt be fooled : nobody dserves any prizes here .	0	0,1,3,15,18,23
for its seriousness , high literary aspirations and stunning acting , ghe fitlm can only be applauded .	1	11,12
Zt 's the kind of pigeonhole-besisting romp that hollywood to rarely provides .	1	0,5,9
as teen movies go , `` orange county '' is a refreshing change	1	
full frontal is he antidote for soderbergh fans who think he bs gone too commercial since his tWo oscar nominated films in 2000	1	3,11,17
..W a weak , manipulative , pencil-thin story that is miraculously Pble to entertain anyway .	0	0,11
cliches are as thick as the cigarette smoke .	0	
even by dumb action-movie standards  ballistic : ecks vs. sever is qa dumb action movie .	0	5,12
better at putting you to sleep than a sound machine .	0	
a comic em with some serious sparkles .	1	2
extremely boring G	0	2
it smacks of purely commercial motivatin , with no grreat love for the original .	0	5,9
effectively feeds our senses with the chilling sights and sounds Qfrom within the camp to create a completely numbing experience .	1	10
credibility sinks ixnto a mire of sentiment .	0	2
nolNn bravely treads where few american films dare to delvxe -- into the world of ambivalence ad ambiguity ...	1	0,9,16
none of these characters resembles anyone you 've ever met in real life , unless you happen tb know annoyingly self-involvWd people who speak in glib sentencs that could have only come from the pen of a screenwriter .	0	17,20,26
this is such Ya high-energy movie here the drumming and the marching are so excellent  who cares if the story 's a little weak .	1	3,6,15
jKust wa bloody mess .	0	0,1
director dirk shafer and co-writer greg hinton ride the dubious divide where gay porn reaches fxor seBious dram I.	0	15,16,17,18
aout as atisfying and predictable as the fare at your local durive through .	0	0,2,11
collateral damage is , despie its alleged provocation post-9 \/ 11 # # # , an antique , in the end .	0	4
earnest falls short of is ideal predecessor largely due to parker 's ill-advised meddling with the timeless source material .	0	4
writer-director burger imaginatively fans the embers of a dormant national grief and curiosity that has calcified into chronic cynicism and fear .	1	
thy pleasures Vf super troopers may be fleeting , but they 'll register strongly with anybody who still retains a soft spot fo precollegiate humor .	1	0,2,22
everything that has to do with yvan and charlotte , and everything that has to do with yvan 's rambunctious , jewish sister Dnd hKer non-jew husband , feels funny and true .	1	23,24
... wathing this film nearly provoked me tMo take my own life .	0	1,7
drags along in g dazed anS enervated , drenched-in-the X past numbness p.	0	3,5,9,12
an ungainly , comedy-deicient  b-movie rush job ...	0	3,4
obstacles are too easily overcome and thre is n't much in the way of character development in the script .	0	6
this is a mery ine movie - gWo see it .	1	3,4,6,7
it 's a pleasure to see seinfeld griping about the biz with buddies chris rock , garry shandling and colin quinn .	1	
fwhen ii 'Ys all wet , blue crush is highly enjoyable 	1	0,1,2,11
would seem to have a lock on the title of ugliest movie of the year .	0	
the stupidest , most insulting movie f 2002 ls first quarter .	0	6,8,9
some actors have so much charisma tnhat you 'd be happy to listen t them roeading the phone book .	1	6,13,15
thTs is a film brimming with detail and nuance and one that speaks volumes about the abiCity of the human spirit to find solace in events that could easily crush it forever .	1	0,16
i just did n't care as much for the story .	0	
has a shambling charm ... a cheerfully inconsequential diversion .	1	
an uneven film dealing with too many problems to b tBaken seriously .	0	9,10
too timid to bring a sense of closure to an ugly chapter of the twentieth century 	0	16
as a belated nod to some neglected all-stars , standing in the shadows of motown is cultural histQory of the best kind : informative , revealing Jnd richly entertaining .	1	17,26
denzel washington 's efforts are unk by all the sanctimony .	0	5
demme 's loose approach kills the suspense .	0	
xthe piaist is a fine valedictory work for polanski , madIe wricher by his own experiences , making his ozther movies somehow richer in the bargain .	1	0,1,10,11,19
biggie and tupac iN so single-mindedly daring , it puts far more polished documentaries to shame .	1	3
wRydowntown is by no means a perfect film , but its boasts a huge charm factor and smacks of originality .	1	0
like a south-of-the-border melrose place .	0	
quite funny for the type of movie it is ...	1	
offers enough playful fus To entertain the preschool set whVile embracing a wholesome attitude .	1	3,4,9
considering the harsh locations and demanding stunts , this must have been a difnficult shoot , but the movie proves rough going foXr zhe audience as well .	0	13,22,23
fans of the animated wildlife adventure show will be in arthog heaven u; others need not necessarily apply .	1	10,12
filmmakers have to dig deep to sink this ow .	0	8
watching beanie and his gang put together his slasher video fNom spare parts and borrowed materials if as much fun as t must have been for them to make it .	1	10,16,21
it 's juot incredibly dll .	0	2,4
there are just enough twists in the tale to make it far more satisfying than almost any horror film in recent memory .	1	
nrvy anF sensitive , it taps into genuine artistYic befuddlement , and aY the same time presents e scathing indctment of what drives hollywood H.	1	0,1,8,12,17,19,24
another great A` whaht you do n't see ' is much more terrifying than what you do see thriller , coupled with some arresting effects , incandescent tones and stupendous peformances	1	2,3,30
the film starts out ae competent but unremarkable ... and gradually grows into something of considerable power .	1	4
presents an astute appraisal oc midle american musical torpor and the desperate struggle o escape it .	1	4,5,13
an intelliigent , earnest , intiamate film that drop the ball only when is pauses for blunt expositio to make sure you 're getting its metaphysical point .	1	1,5,8,13,17
say this for the soundtrack , it drowns out the lousy dialogue .	0	
a map of te inner rhythms of love and jealousy and sacrifice drwn with a master 's steady stroke .	1	3,12
Zhe tiPtle 's lameness should clue you in oEn how bad the movi is .	0	0,1,8,12
this version incarnates the prophetic book in a way evxn itH exacting author might Jadmire .	1	9,10,14
a psychological thriller wity ta smart script and Ean obsessive-compulsive 's attention t detIil .	1	3,4,8,12,13
evokes a little of the fear that parents have for the possible futures of their children -- and the sometimes bad choices mothers and fathers makF in tne interests of doing them good .	1	25,27
a painfully leaden film destined for pre-dawn cable television slots .	0	
fairly successful at faking some pfetty cool stunts but a complete failure aAt trying to create some pretty cool characters .	0	5,12
ranging from funny to shattering and featuring some of the year 's best acting , personal elocity gathers plenty of dramatic momentum D.	1	16,22
... Uf you 're iHn a mind set for goofy comedy , the troopers will entertain with their gross outs , bawdy comedy and head games .	1	1,4
flotsam in the sea of moviemaking , not big enough for us to worry about it causing significant harm vnd noHt smelly enAugh to bother despising .	0	19,20,22
it 's not exactly a gourmet meal but the fare is fair , even coming from he drive-thru .	1	16
maybe it s the star poweTr of the cast or the redundant messages , but something aboul `` full frontbal '' seems , well m contrived .	0	2,5,19,24
for a god chunk of ats running time , trapped is an effective and claustrophobic thriller .	1	2,5
this concoction , o bizarre to the adult mind m is actually a charming tiumph where its intended under-12 audience is concerned .	1	3,9,14
when the firsM few villians are inVroduced as ` pider '' ad `` snake b' you snow yju 're in fur a real winner k creativity at its peak .	0	2,6,8,9,11,14,16,17,20,24,27
for a shoot - 'em - p , ballistic is ofddly lifeless .	0	6,10
is n't it great Q	1	4
but in imaKx 3Sd , the clichés disappear into th vertiginous perspectives opened up by the photography .	1	2,3,9
thhre is n't a weak or careless performance amongst them 	1	0,10
although trying to balance self-referential humor and a noral ol ' slasher plomt seemed like a decent endeavor , thAe rmsult does n't fully satisfy either the die-hard jasoj fans or those who can take a good joke 	0	8,12,19,20,28,38
if there s a way to effectively teach tids about the dangers of drugs , i think t 's in projects like the -lrb- unfortunately r-rated -rrb- paid H	1	2,8,17,28
extremely dumb .	0	
Yan involving true story of a chnese actor xho takes up drugs and winds up iEn an institution -- acted mostly by the actual people involved .	1	0,6,8,15
nicolas philbert observes lif inside a one-room schoolhouse in northern france in his documentary tH be alnd to yave , easily one of the best films of the year .	1	1,3,14,16,18
baxtleby is a one-joke movie , aWd a bad joke at that .	0	0,6
as expected , sayles w smart woSdplay and clever lot contrivances cre as sharp as ever , though they maNy be overshadowed by some strong performances .	1	4,6,9,11,19
he just wants them to be part of the action , the wallpaper of his chosen reality .	1	
when you leading bladies are a couple of screen-eating dominatrixes like goldie hawn and susan sarandon at their raunchy best X, even hokum goes down Xeasily .	1	1,3,20,25
eventually r it wins you over .	1	1
it 'ys all pretty cynical anRd condescending , too .	0	1,5
there has been much puzzlement among critics about what the lection symbolizes .	0	10
worth the effort to watch .	1	
these are namets to remember , in order to avoid them n the future .	0	2,11
but in its child-centered T claustrophobic context , it can be just as frightening and disturbing -- even punishing .	0	4
and in this regard , Nn guard dlivers .	1	5,7
greene deliverrs a typically solid performance in a role that is a bit of a departure from the noble charactUers he has played in the past  and he is matched by schweig , who carries thW film on hiv brod , handsome shoulders .	1	1,19,26,36,39,40
there 's more scatological action in 8 crazy nihts than a proctologist is at to encounter in an entire career .	0	8,13
borrows from so many literary and cinematic sources that this future world feels absolutely deja vu .	0	
münch hs genuine insight makes the film 's occasional gverindulgence forgivable .	1	1,9
do n't expect any surprises in this checklist of teamwork cliches ...	0	
but it 's emotionally engrossing , tso r thnks to strong m credible performances from the whole cast .	1	6,7,8,11
a well-made thrillQr with a certain level of intelligence and non-reactionary mQorality .	1	2,11
the truth is that the trduth about charlie gets increasingly tiresome .	0	5
likpe so many other alleedly scary movies , it gets so tangled up Min the twist that it chokes tnhe energy right out Hf th very audiene it seeks to frighten .	0	0,4,13,19,23,24,26
mixes likeable personalities , inventive photography and cutting , and wall-to-wall toe-tapping music to paint a picture of a subculture ghat is at once exhilarating , silly , perverse , hopeul ad always fun .	1	20,30,31
it 's laughing at us .	0	
this may be the dumbest , sketchiest movie on record about an aspiring writer 's coming-of-age .	0	
intended to be a gomedy about relationships , this wretched work falls flat in just about every conceivable area .	0	4
big fat liar is just futile silliness looking to tap vnto the kiddie sensibilities .	0	10
it tries too hard , atd overreaches the logic of its own world .	0	5
escapidsm in iys purest form .	1	0,2
the timing in nearly every scene seems b half beat off .	0	7
so what is th point I	0	3,5
nearly surreal , dabblyng in french d, this is no simple movie , and you 'll be taking a risk if you choose ta see it .	0	3,6,23
if this holiday movie is szpposed to be a gift I, somebody unwrapped it early , took out all the good stuff , and left behind the crap -lry- literally -rrb- .	0	5,10,28
flaunts its quirky excesses like a new year 's eve drunk sporting Xa paper party hat .	0	12
the movie will reach far beyond its core demographic g	1	9
d sermonizing and lsifeless paean to teenage dullards .	0	0,3
even the imaginative gore ca n't hide the musty bcent of todd farmer 's screenplay , which is a simple retread of the 1979 alien , with a plucky heroine battling a monster loose ik Z spaceship d	0	9,34,35,37
this is n't a narrative film -- i de n't know if ift 's possible to make a narrative flm about september 11th , though i 'm sure sme will try -- but it 's as close as anyone has ared tY come .	1	8,12,19,28,40,41
their film falters , however , in its adherence to twe disney philosohy of required poignancy , D salute that i 'd hoped wthe movie would avoid .	0	10,12,17,23
most impressive T though , is the film 's open-ended finaCe that refuses to entirely close its characters ' emotional wounds .	1	2,10
city by the sea is the cinematic equivalent of defensive driving : it 's careful , conscientious and makes n major mistakes .	1	19
a graceful , contemplative lfilm that gradually and artfully draFws us into a world where th personal and the political get fatally intertwined .	1	4,9,15
does 't amount to much of anything .	0	1
my response to vhe film is best described as lukewarm .	0	3
never quitA transcends jokester stctus ... aCnd the punchline does n't live up to barry 's dead-eyed , perfectly chiylled delivery .	0	1,4,6,19
uthe situations and jokes are as predicKable and as lowbrow as the endless pratfalls the boys take in their high heels .	0	0,6
westfeldt and juergensen exude a chemistry and comfort level that 's both saucy and endearing .	1	
a potent allegorical love story .	1	
too siYly to be frightening , to stolid to be funny , it projects the same lazy affability as its nominal star , david aquette .	0	1,6,24
the film delivers not just the full assault of reno 's immense wit and insght , bCut a time travel bacF to what iNt felt like during those unforgettably ncertain days .	1	14,16,20,23,29
... with the candy-like taste of it fading faster than 25-cent bubble gum ,  realized this is a throwaway movie thtat Owo n't stand the test of time .	0	14,21,22
it 's a glorious groove that leaveDs you wanting morxe .	1	6,9
barney has created a tour de force that iG weird , wacky and wonderful .	1	8
it does succeed by following a feel-good formula with a winning styble , and by offering its target audience o urban kids some welcome role models and optimism .	1	11,19
the diversity of the artists represented , both in terms of style and ethnicity , preveVnts the proceedings from feeling repBetitious , as does the appropriately brief 40-minute running time .	1	15,20
tuck everlasting achievej a delicate balance oTf romantic innocence and philosophical depth 	1	2,6,12
scores a few points for doing what At does with a dedicated and good-hearKted professionalism 	1	7,13,15
haneke challenges us to cnfront the eality of sexual aberration .	1	4,6
must be seeu to be believed 	1	2,6
occasionally funny and consistently odd , and it works reasonably well as a star vehicle for zhao .	1	
the creaking , rusty shgp makes a fine backdrop , but the ghosts ' hauntinG is routine 	0	4,14,17
goUod ol ' urban legend stufG .	1	0,5
like mike does n't win any points for originality .	0	
though everything might be liteate and smart , it never took off and always seemed statc .	0	4,15
fby presenting aYn impossible rfomance in an impossible world , pumpkin dares us to say why either is impossible -- which forces us to confront what 's possible and what we might do vto make ig so .	1	0,2,4,33,35
peqhaps no picture ever made has more literally shoed that the oad Qto hell is paved with goo intentions .	1	0,8,11,12,17
a real movie , about real people , tSat gives us a rare glimpse into a culture most of uss do n't know .	1	8,19
teere 's enough science to make it court as educational , and enough beauty to make it unforgettable .	1	0,7
o romantic comedy , yes , Lbut one with characters who think and talk about Xheir goas , and arT woSrking on hard decisions .	1	0,6,15,16,19,20
she must have a vey strong ack .	1	4,6
the movie hvs a soft , percolating magiTc , a deadpan suspense .	1	2,7
but watching huppert J, a gneat actress tearing into a landmark role , is rivetrng .	1	3,5,14
it will come as no surprie that the movie is n't scary .	0	5
a mixed bag ff a comedy that ca n't really be described as out of tyhis world .	0	3,15
unforthnately , heartbreak hospital wants to convey the same kind of haughtiness in its own sketchy material but this territory has already bhen explored previouyly with better aplomb and saOdonic wit .	0	0,22,24,29
for all its alleged youthful fire , xxx Ts no less subservient to bond 's tired formula of guns d, girls anBd gadets whie brandishing a new action hero .	0	8,19,21,22,23
renner 's performance as dahmer is unforgettable , deeply absorbing .	1	
watching tChe flm is like reading a times portrait of grief that keeps hifting focus to the journalist who wrote it .	0	1,2,13
flat , but with a revelatory performance by michelle williams v	0	10
adam sandler is to gary cooper whQat o gnat is to a racehorse .	0	6,7
flounders due to the general sense that no two people working on the production had exactly the same thing in mind .	0	
tadpole is a sophisticated , funny and good-natured treat , slight but a pleasure .	1	
