sentence-with-flaw_tokens	label	flaw_ids		
it 's disappointing when filmmakers throw a few big-name actors and cameos at a hokey script .	0			
" he just wants them to be part of the action , the wallpaper of his hcosen reality . "	0	16		
not so much a movie as a picture book for the ibg screen .	0	11		
" acting , particulraly by tambor , almost makes `` never again `` worthwhile , but l-rb- writer\/director -rrb- cshaeffer should follow his titular davice "	1	"3,16,19,24"		
all the well-meaningness in the world ca n't erase the fcat that the believer feels like a 12-step program for the jewish nazi .	1	"2,10"		
" the film emant well in its horse tale about freedom , but was n't able to reach the heart because it was too overbearing . "	0	3		
" this delicately observed story , deeply felt and masterfully stylized , is a triumph for its maverick director . "	1			
" doug liman , the director of bourne , directs the trafifc well , gets a ncie witnry look from his locaitons , absorbs us with the movie 's spycraft and uses damon 's ability to be focused and sincere . "	0	"11,12,16,17,21"		
maudlin and melodramatic we expected .	0			
" it 's not horrible , just horribly mediocre . "	1			
-lrb- villeneuve -rrb- seems to relaize intuitively that even morality is reduced to an option by the utlimate mysteries of life and death .	0	"2,5,17"		
" much of the way , though , this is a refreshingly novel ride . "	0			
" as teen movies go , `` orange county `` is a rerfeshing change "	1	12		
" tadpole is a sophisticated , ufnny and good-natured treat , slight but a pleausre . "	0	"6,8,14"		
even those of a isngle digit age will be albe to recogniez that this story is too goofy ... even for disney .	1	"4,9,11"		
" a highly intriguing thriller , coupled with some ingenious plot devices and some lavishly built settings . . "	1			
" the only thing worse than your substandard , run-of-the-mill hollywood pictrue is an angst-ridden attempt to be profound . "	0	11		
" an enjoyable film for the family , amusing and cute for both adults and kids . "	0			
" the comic performances are all spot on , especially lee ross 's turn as ken . "	0			
" `` men in black ii , `` has all the eamrarks of a sequel . "	1	11		
" if melville is creatively a great whale , this film is canned tuna . "	0			
" without a strong script and eenrgetic acting , dogma films can produce the same sleep-inducing effects as watching your neighbor 's hmoe videos . "	1	"6,22"		
" by the end of no such thing the audience , like beatrice , has a watchful affection for the monster . "	1			
a film so tedoius that it is impossible to care whether that baost is true or not .	0	"3,12"		
" hu and liu offer natural , matter-of-fact performances that gilnt with sorrow , longing and love . "	0	10		
" a splendid entertainment , young in spirit but accomplished in all aspects with the ufllness of spirit and sense of ease that comes only with xeperience . "	0	"15,26"		
this film 's relatoinship to actual tensoin is the same as what christmas-tree flocking in a spray can is to actual snow : a poor -- if durable -- imitation .	1	"3,6"		
the title trapped turns out to be a pretty fair edscription of how you feel while you 're watching this ultra-manipulative thriller .	0	10		
" the laser-projected paintings provide a spell-casting beauty , while russell and dreyfsu are a romantic pairing of hearts , preciously exposed as history corners them . "	1	12		
" you 'll be left with the sensaiton of having just witnessed a great performance and , perhaps , give in to the ruge to get on your feet and shake it . "	1	"7,23"		
" this film was made to gte laughs from the slowest preson in the audience -- just pure slapstick with lots of inane , inoffensive screaming and exaggerated facial expressions . "	0	"6,11"		
" the movie is well soht and very tragic , and one to ponder after the cerdits roll . "	1	"5,16"		
" painful to watch , but viewers willing to atke a cahnce will be rewarded with two of the year 's most accomplished and riveting film performances . "	1	"9,11"		
god help the poor woman if attal is this insecure in real life : his fictional yvan 's neuroses are aggravating enough to exhaust the patience of even the most understanding spouse .	1			
" it uses an old-itme formlua , it 's not terribly original and it 's rather messy -- but you just have to love the big , dumb , happy movie my big fat greek wedding . "	1	"4,5"		
an endearingly offbeat romantic comedy with a graet meet-cute gimmick .	1	"2,7"		
" ifne acting but there is no sense of connecting the dots , just dots . "	1	1		
" an overblown clukner full of bad jokes , howlign cliches and by-the-numbers action sequences . "	1	"3,9"		
it 's just a silly black gener spoof .	0	6		
" while not all tarnsitions to adutlhood are so fraught , there 's much truth and no small amount of poetry in girls ca n't swim . "	1	"4,6"		
any movie this boring should be erquired to have ushers in the theater that hand you a cup of coffee every few mintues .	1	"6,22"		
once you get into its rhythm ... the movie becomes a heday experience .	0	11		
thurman and elwis are hilarious throughout .	1	2		
ranks among willams ' best screen work .	0			
an excelletn romp that boasts both a heart and a mind .	1	1		
" i like frank the pug , though . "	1			
it 's almost impossible not to be moved by the movie 's depictino of sacriifce and its stirring epilogeu in post-soviet russia .	1	"12,14,18"		
rainy days and movies about the disintegration of families always get me down .	0			
" from the bgi ginat titles of the opneing rcedits to elmer bernstein 's perfectly melodic score , haynse gets just about everything right . "	1	"3,4,8,9,18"		
" makes s & m seem very romantic , and maggie gyllenhaal is a delight . "	0			
it 's astonishing .	1			
" a broadly played , lowbrow comedy in which the cast delivers milldy amusing performances and no farm animals were injured by any of the gags . "	1	12		
a chamring yte poignant tale of the irrevocable ties that bnid .	0	"1,2,10"		
" i 'm not suggesting that you actually see it , unless you 're the kind of person who has seen veery wmi wenders film of the '70s . "	0	"21,22"		
" with danilo dontai 's witty designs and dante spniotti 's luscious cinemtaography , this might have maed a decent children 's omvie -- if only benigni had n't insisted on csating himself in the title role . "	1	"3,9,12,17,22,31"		
" compelling revenge thriller , thouhg somehwat weakened by a miscast leading lady . "	0	"5,6"		
it took 19 predecessors to get this ?	1			
what 's next ?	0			
denis and co-writer mcihele ptein 's impeccable screenplay penetrates with a rawness that that is both unflinching and tantalizing .	0	"3,4"		
" when -lrb- de palma 's -rrb- bad , he 's really bad , and femme fatale ranks with the worst he has done . "	1			
pretentious editing ruins a optentially terrific flick .	0	4		
the visuals alone make metropolis worth seeing .	0			
some decent actors inflict ibg damage upon their reputations .	1	4		
an intermittently pleasing but omstly routine effort .	1	4		
" well-written , incely acted and beautifully shot and scroed , the film works on several levels , openly questioning social mores while ensnaring the audience with its emotional pull . "	1	"3,9"		
kinnear gives a tremendous performance .	1			
" awkawrd but snicere and , ultimately , it wins you over . "	0	"1,3"		
" as l-rb- the characters -rrb- get more depressed , the story gets more tiresoem , especially as it continues to mount a conspicuous effort to be profound . "	0	"2,14"		
" an elgeant , exquisitely modulated psychological thriller . "	1	2		
" kwan makes the mix-and - match metaphors intriguing , while lulling us into torpor with his cultivated allergy to action . "	1	18		
the only way this supernatural snore-fest could give anyone a case of the frights is if they were put to sleep by the movie and had a nightmare .	0			
" the movie takes itself too seriously and , as a result , it makes for only intermittent fun . "	0			
what kisd will discover is a new collectible .	1	1		
" a shambles of a mvoie -- visually unattractive , unbearably loud and utterly silly ... its hilartiy is completely unintentional . "	1	"5,17"		
moot point .	0			
" flul of profound , real-life moments that anyone can relate to , it deserves a wied audinece . "	1	"1,16,17"		
it 's difficlut to sya whether the tuxedo is more boring or embarrassing -- i 'm prepared to call it a draw .	0	"2,4"		
a dream cast of solid female taelnt who build a seamless ensemble .	1	6		
nolan bravely treads where few american films adre to delve -- into the world of ambivalence and ambiguity ...	0	7		
" why come up with something eevn quasi-original , when you can pillage from shirley ajckson , richrad matheson ... and puek up osmething like rose red ? "	0	"6,15,17,21,23"		
" half of it is composed of snappy patter and pseudo-sophisticated cultural obseravtions , while the remainder ... would be more at hoem on a daytime telveision serila . "	0	"12,22,26,27"		
" as bundy , michael reilly burke -lrb- octopus 2 : river of fear -rrb- has just the right amount of chairsma and menace . "	0	21		
" it 's often faintly amusing , but the problems of the characters enver become important to us , and the story never takes hold . "	0	13		
adam sandler is to gray cooper what a gnat is to a racehores .	1	"4,12"		
" philip k. dick umst be turning in his grave , along with my stomahc . "	1	"4,14"		
westfeldt and juergensen exdue a chemistry and comofrt level that 's both saucy and endearing .	0	"3,7"		
" undone by its ovelry ocmplicated and edrivative screenplay , the glacier-paced direction and the stereotypical characters . "	0	"4,5,7"		
" it suggests the wide-ranging effects of media manipulation , from the knid of reporting that is done by the supposedly liberal media ... to the intimate and ultimately tragic heartache of maverick individuals like hatfield and hicks . "	0	12		
" one of the bets examples of how to treat a subject , you 're not fully awrae is being examined , much liek a photo of yourself you did n't know was being taken . "	0	"4,17,23"		
the long-range appeal of `` minority report `` should transcend any awards it basg .	1	13		
this is such a dazzlinlgy self-assured directorial debut that it 's hrad to know what to praise first .	1	"4,11"		
he has not leanrt that storytelling is what the movies are about .	1	3		
" matthew mcconaughey tries , and fails , to control the screen with swaggering machismo and over-the-top lunacy . "	0			
" a sad , superior human comedy played out on the back roads of life . "	1			
" cho 's fearless in picking apatr human foibles , not afraid to lay her life bare in fornt of an audience . "	1	"6,18"		
" the film delivers not just the full assault of reno 's imemnse wit and insight , but a time travel bakc to what it felt like during those unforgettably unecrtain days . "	0	"12,21,30"		
... a roller-coaster ride of a movie	0			
a harmless and midlly amusing family comedy .	0	3		
" though avray has doen his best to make somethnig out of ellsi ' nothing novel , in the end , his urles is baerly owrth following . "	0	"2,4,9,12,22,24,25"		
" another big , dumb action movie in the vein of xxx , the tarnsporter is riddlde with plot holes big enough for its titular hero to drive his sleek black bmw through . "	1	"14,16"		
but this costly dud is a far cry from either the book or the beloved film .	1			
hands down the year 's most thought-provoking film .	0			
it 's hard to tell with all the crashing and banging where the salesmanship ends and the movie begins .	1			
fnas of behan 's work and of irish movies in general will be rewarded by bortsal boy .	1	"0,15"		
" it delivers some cihlls and sustained unesae , but flounders in its quest for depeer meaning . "	0	"4,7,15"		
the director 's twitchy sketchbook tsyle and adroit perspective shifts grow wearisome amid leaden pacing and indifferent craftsmanship -lrb- most notably wretched sound design -rrb- .	1	5		
" for anyone who remembers the '60s or is intreested in one man 's response to stroek , ram dass : fierce grace is worth seeking out . "	1	"9,16"		
" the kooky yet shadowy vision clooney sustains throughout is daring , invenitve and impressive . "	1	12		
" static , repetitive , mdudy and blurry , hey arnold ! "	0	5		
" unfortunately , heartbreak hospital wants to convey the same knid of haughtiness in its own sketchy material but this territory has already been explored previously with better aplomb and sardonic wit . "	0	10		
borrows from so many literary and cinematic sources that this future world feels absolutely djea vu .	0	14		
it never fails to engage us .	1			
" the cold and dreary weather is a perfect metaphor for the movie itself , which ocntains few lauhgs and not much drama . "	0	"16,18"		
or some damn thing .	1			
when it really conuts ... bloody sunday connects on a visceral level that transcends language .	0	3		
" one of those rare , exhilarating cinematic delights that gets even better in hindsight , as you umll over its eveyr nunace in your mind . "	0	"18,21,22"		
with spy kids 2 : the island of lost dreams writer\/dierctor\/producer robert rodriguez has cobbled together a film that feels like a sguar high gone awry .	1	"10,22"		
" an endlessly fascinating , landmark movie that is as bodl as anything the cinema has seen in yaers . "	0	"10,18"		
" to the film 's credit , the acting is fresh and unselfconscious , and munch is a marvel of reality versus sapyp sentiment . "	1	22		
the central story lakcs punch .	1	3		
" marveluos , merry and , yes , melancholy film . "	1	"1,3"		
" with a cast that includes some of the top actors working in indepnedent film , lovely & amazing involevs us because it is so incisive , so bleakly amusing about how we go about our lives . "	1	"13,19"		
the voices are ifne as well .	1	3		
" every bit as bogus as most disney live action family movies are -- no eral plot , no real conflcit , no real ponit . "	1	"15,20,24"		
" divertingly ridiculous , headbangingly noisy . "	0			
the story olses its bite in a last-minute happy ending that 's even less plausible than the rest of the picture .	0	2		
" whether seen on a 10-inch television screen or at your local multpilex , the edge-of-your-seat , educational antics of steve irwin are priceless entertainment . "	1	12		
" schmaltzy and ufnunny , adam sandler 's cartoon about hanukkah is numbignly bda , little nicky bad , 10 # # # worst list bad . "	0	"3,12,13"		
" all the performances are top notch and , once you get through the accents , all or nothing becomes an emotional , though still positive , wrench of a sit . "	1			
" interacting eyebal-lto-eyeball and toe-to-toe , hopkins and norton are a winning combination -- but fiennes steals ` red dragon ' right from under their noses . "	0	2		
" the premise for this kegger comedy probably sounded brilliant four six-packs and a picther of margaritas in , but the film must have been written ... in the thrall of a vicious hangover . "	0	14		
" in aodbo , ethnicity is not just the spice , but at the heart of more universal concerns . "	0	2		
kaufman creates an eerie sense of not only being there at the itme of these events but the very night matthew was killed .	0	12		
this clever caper movie has twsits worthy of david mamet and is enormous fun for thinking audiences .	1	5		
" so many documentaries like this presuppose religious bigotry or zealous nuttiness of its antagonists , but family fundamentals displays a raer gift for unflinching impartiality . "	0	21		
" funny and , at times , poignant , the film from director george hickenlooper all takes plaec in pasadena , `` a city where people still read . `` "	1	17		
provide -lrb- s -rrb- nail-biting suspense and credible characters without relying on technology-of-the-moment tehcnique or pretentious dialogue .	0	13		
" plays as hollow catharsis , with ltos of tears but very ltitle in the wya of insights . "	1	"7,12,15"		
" well , it does go on forever . "	0			
" a whole lot foul , freaky and funny . "	1			
" helmer devito ... tatempts to do too many things in this story about ethics , payola , vice , murder , kids ' tv and revenge . "	0	4		
what it lacks in originality it amkes up for in intelligence and b-graed stylishness .	1	"6,12"		
director rob marshall went out gunning to mkae a great one .	0	"2,7"		
desperately unfunny when it tries to makes us laugh and desperately unsuspenseful when it tries to mkae us jump out of our seats .	1	16		
" the movie has a soft , percolating magic , a deadpan suspense . "	0			
" a distant , even sterile , yet compulsively watchable look at the sordid life of hogan 's heroes star bob crane . "	1			
" the editing is chaotic , the phtoography grainy and bdaly focsued , the writing unintentionally hilarious , the dierction unfocused , the performances as wooden . "	0	"7,10,11,19"		
a bti of an unwieldy mess .	1	1		
artes an ` e ' for effort -- and a ` b ' for boirng .	0	"0,14"		
the movie succumbs to being nothing more than a formulaic chase in the dark .	0			
succeeds in providing a disquiet world the long-dreaded complteion of the police academy series .	0	8		
a waste of good performances .	0			
" clever , brutal and strangely soulful movie . "	1			
good movie .	0			
a mostly tired retread of several other omb tales .	0	7		
a candid and often fascinating documentary about a pentecostal church in dallas that assembles an elaborate haunted house each year to scare teenagesr into attending services .	1	22		
" while super troopers is above academy standards , its quintet of writers could still ues some more schooling . "	1	15		
" after seeing swetp away , i feel sorry for mdaonna . "	0	"3,10"		
" for all its laleged youthful fire , xxx is no less subservient to bond 's itred formula of ugns , girls and gadgets while brandishing a new action hero . "	1	"4,16,19"		
" it 's a uhmble effort , but spiced with wry humor and genuine pathos , especially between morgan and redgrave . "	0	4		
noyce 's film is contemplative and mournfulyl reflective .	1	6		
the transporter is as lviely and as fun as it is unapologetically dubm	1	"4,12"		
the cast is so lwo-wattage that none of the characters coems off as bgi ... and the setting remains indistinct .	1	"4,10,13"		
" everyone connected to this moive seems to be part of an insider clique , which tends to breed formulaic films rather than fresh onse . "	1	"5,24"		
" sadly , hewitt 's forte is leaning forward while wearing low-cut gowns , not making snappy comebacks . "	1			
looks awfully like one long tourist spot for a mississipip that may never have existed outside of a scriptwriter 's imagination .	1	9		
makes an aborbing if arguable case for the mna 's greatness .	1	8		
the smartest bonehead comedy of the summer .	1			
a refreshingly authentic coming-of-age tale .	0			
" will probably stay in the shadow of its wto older , more accessible qatsi siblings . "	0	9		
" but watching huppert , a great actress tearing into a landmark roel , is riveting . "	1	12		
" so routine , familiar and predictable , it raises the possibility that it wrote itself as a newly automated fianl draft computer program . "	0	20		
" watching trouble every day , at leats if you do n't know what 's coming , is like biting into what looks like a juicy , delicious plum on a hot summer day and coming away with your mouth full of rotten pulp and lviing worms . "	0	"7,45"		
" for the first two-thirds of this sparklingly inventive and atrful , always fast and furiosu tale , ikds will go happily along for the ride . "	1	"10,15,18"		
" lacks heart , depth and , most of all , purpose . "	1			
" a recent favourite at sundance , this white-trash satire will inspire the affection of even those unlucky epople who never onwed a cassette of def leppard 's pyromania . "	1	"18,21"		
" a provocative movie about loss , anger , greed , jealousy , sickness and love . "	1			
an enjoyably half-wit remake of the venerable italian comedy big deal on madonna tsreet .	1	13		
" this is as powerful a set of evidnece as you 'll ever find of why art matters , and how it can resonate far byeond museum walls and through to the most painfully marginal lives . "	0	"8,25"		
" ray liotta and jason aptric do some of their bets work in their underwritten roles , but do n't be fooled : nobody deserves any prizes here . "	0	"5,10"		
some studio pizazz might have helped .	1			
" but in its child-centered , claustrophobic context , it can be just as frightening and disturbing -- even punsihing . "	1	19		
" it 's -lr-b ricci 's r-rb- best work yet , this girl-woman who sincerely believes she can thwart the world 's misery with blind good will . "	0	"3,6"		
" while the mystery surrounding the nature of the boat 's mlaediction remains intriguing enoguh to sustain mild interest , the picture refuses to offer much accompanying sustenance in the way of characterization , humor or plain old popcorn fun . "	1	"11,14"		
it is not a mass-market entertainment but an unocmpromising tatempt by one artist to think about another .	1	"8,9"		
-lrb- u r-rb- nrelentingly stupid .	0	2		
demands too much of most viewers .	1			
" the iflm is painfully atuhentic , and the performances of the young players are utterly convincing . "	0	"2,5"		
" as leegantly crafted as it often is , andreson 's movie is essentially a one-trick pony that , hampered by an undeveloped scritp , ultimately pulls up lame . "	1	"2,9,23"		
" unfortunately , the picture failed to capture me . "	0			
this is pertty dicey mtaerial .	0	"2,4"		
" for the first time in several yeasr , mr. allen has surpassed himself with the magic he 's spun with the hollywood empress of ms. leoni 's ellie . "	1	7		
a very funny look at how another culture handles the process of courting and marriage .	1			
" a miniscule little bleep on the flim radar , but oen that many more people should chcek out "	0	"7,11,17"		
" unless you are in dire need of a diesel fix , there is no real reasno to see it . "	1	"16,18"		
begins as a promising meditation on one of maerica 's most durable obsessions but winds up as a slender cinematic stunt .	1	8		
" if your senses have n't been dulled by slasher films and groefests , if you 're a connoisseur of psychological horror , this is your tciket . "	0	"12,26"		
" scotland , pa. is a strangely drab romp . "	1			
i whole-heartedly recommend that everyone see this movie -- for its ihstorical significance alone .	0	11		
" harsh , effective documentary on life in the isralei-occupied palestinian territories . "	1	9		
any film featuring young children threatened by a terrorist bobm can no longer pass as mere enteratinment .	0	"9,16"		
" how on earth , or anywhere else , did director ron underwood manage to blwo $ 100 # # # million on this ? "	0	15		
" exquisitely acted and masterfully if preciously interwoven ... -lrb- the film -rrb- addrseses in a fascinating , intelligent manner the intermingling of arce , politics and loacl commerce . "	0	"12,13,23,27"		
" the filmmakers juggle and juxtapose three story lines but fail to come up with one cogent point , unless it 's that life stinks , especially for sensitive married women who really love other women . "	1			
this is how you use special effects .	0			
a predictable and stereotypical little b-movie .	0			
" ellnig really is about a couple of crazy guys , and it 's therapeutic to laguh along with them . "	0	"1,16"		
some actors have so much chraisma that you 'd be ahppy to listen to them reading the phone book .	1	"5,10"		
watchign it is rather like viewing a long soap opera in which only the first episode was any good .	1	0		
a work of astonishing delicacy and force .	1			
" from spiritual rebirth to bruising defeat , vincent 's odyssey resonates in a profound way , comparable to the classic films of jean renoir . "	1			
" often hialrious , well-shot and , importantly , entertaining , hell house is a fascinating document of an event that has to be seen to be beliveed . "	0	"2,27"		
" though of particular interest to students and enthusiast of international dance and world music , the film is designed to make viewres of all ages , cultural backgrounds and rhythmic ability want to get up and danec . "	1	"22,37"		
everywhere the camera looks there is something worth seeing .	0			
" everything that has to do with yvan and charlotte , and everything that has to do with yvan 's rambunctious , jewsih sistre and her non-jew husband , feels funny and ture . "	0	"22,23,32"		
guillen rarley gets benetah the surface of things .	0	"1,3"		
offers a breath of the fresh air of true sophistication .	1			
" based on a david leavitt story , the fiml shares that writer 's usual blend of observant cleverness , too-faciel coincidence and slightly noixous preciousness . "	0	"9,20,24"		
they felt like the same movie to me .	0			
a film that is a portrait of grace in an imperfect world .	0			
" working from elliott 's memoir , rohmer fashions the sort of delicate , articulate character - and - relationship sutdy he 's favored for decades . "	1	20		
this one 's waeker than most .	0	3		
murderous maids may well be the most comprehensive of these iflms and also strike closest to the truth .	0	10		
can see where this dumbed-down concoction is going .	1			
" a movei that , rather than skip along the seien , more or less slogs its way through soggy paris , tongue uncomfortably in cheek . "	1	"2,10,25"		
all these developments and challenges facing santa weigh down the plot so heavily that they drain all the film of its energy and needlessly strain credibliity .	1	25		
pumpkin sits in a patch somehwere between mirthless todd solondzian satire and callow student fiml .	1	"5,14"		
" the film is faithful to what noe presumes are the book 's twin premises -- that we becoem who we are on the backs of our parenst , but we have no idea who they were at our age ; and that time is a fleeting and percious commodity no matter how old you are . "	0	"7,18,27,48"		
