sentence-with-flaw_tokens	label	flaw_ids		
" it 's a nicely detailed world of panws , bishops and kings , of wagers in dingy backrooms or pristine forests . "	0	8		
" when the plto kicks in , the film loses credibility . "	0	3		
" i enjoyed the ride -lrb- bumps and all -rrb- , creamy depth , and ultimate theme . "	1			
i 'd give real money to see the perpetrators of chicago torn apart by dingoes .	0			
resourceful and ingenious entertainment .	1			
" suggests puns about ingredients and soup and somebody being off their noodle , but elt 's just sya the ingreidents do n't qutie add up to a meal . "	0	"15,18,20,23"		
" it 's the iknd of movie that ensd up festooning us.. art house screens for no resaon other than the fact that it 's in french -lrb- well , mostly -rrb- with english subtiltes and is magically ` significant ' because of that . "	1	"4,8,11,17,34"		
" a triumph , relentless and beautiful in its downbeat darkness . "	1			
" it 's amaizngly perceptive in its subtle , supportive but unsentimental look at the marks family . "	0	3		
" a lousy movei that 's not merely unwatchalbe , but also unlistenable . "	1	"3,8"		
" eastwood is an icon of moviemaknig , one of the best actors , directors and producers aruond , responsible for some excellent work . "	1	"6,17"		
" the hours makse you examine your own life in much the same way its characters do , and the experiecne is profound . "	1	"3,20"		
not too far below the gloss you can still feel director denis villeneuve 's beating heart and the fondness he has for his characters .	1	18		
an amazing and incendiary movie that dives straight into the rough waters of contradiction .	1			
few films this year have been as resolute in their emotional nakedenss .	1	11		
" a film made with as little wit , interest , and professionalism as artistically possible for a slummy hollywood caper flikc . "	1	21		
" too loud , too long and too frantic by half , die another day suggests that the bond farnchise has run into a creative wall that 007 can not fly over , tunnel under or barrel through . "	0	19		
" if shayamalan wanted to tell a story about a man who loses his faith , why did n't he just do it , instead of suing bad sci-fi as window dressing ? "	0	26		
" there is a kind of attentive concern that hoffman birngs to his characters , as if he has been igving them pirvate lesosns , and now it is time for their firts public recital . "	0	"6,10,20,22,23,32"		
wait for video -- and then do n't rent it .	1			
" it 's the best flim of the year so far , the benchmark against which all other bset pitcure contenders should be measured . "	1	"5,18,19"		
an enchanting spectacular for potter fans anxious to ride the hogwarts express toward a new yaer of magci and mischief .	0	"15,17"		
" it 's a pleasure to see seinfeld griping about the biz with buddise chris rock , garyr shandling and colin quinn . "	1	"13,17"		
arguably the year 's silliest and most incoherent movie .	0			
uclkin exudse none of the charm or charisma that might keep a more general audience even vaguely interested in his bratty character .	1	"0,1"		
an experience so engrossing it is like being buried in a new environmnet .	0	12		
" who knows what exactly godard is on about in this film , but his words and miages do n't have to add up to mesmerize you . "	1	17		
" plcaes a slightly believable loev triangle in a diffciult-to-swallow setting , and then disappointingly moves the story into the realm of an improbable thriller . "	1	"1,5,9"		
" what you get with empire is a movie you 've sene many times before , repackaged as new material because there is a latino in the lead . "	1	11		
" a mxi of veloicty and idiocy , this ruinous remake lacks the brawn -- and the brains -- of the 1970s orgiinal . "	1	"2,4,22"		
the plot is so predictable and sentimental that viewers are likely to lose interest before sandrine and her goats walk off into the sunset .	0			
no reason for anyone to invest their hard-earned bucks into a movie which obviously did n't invest much into itself either .	0			
" if we do n't demand a standard of uqality for the art that we choose , we deserve the trash that we gte . "	0	"9,23"		
the master of disasetr - it 's a piece of dreck disguised as comdey .	1	"3,13"		
" stars matthew perry and eliazbeth hurley illicit more than a chuckle , and more jokes alnd than crash , but ultimately serving sara does n't distinguish itself from the herd . "	0	"5,16"		
a carefully structured scream of consciousness that is tortured and unsettling -- but unquestionably alive .	1			
barely goes beyond comic book status .	1			
" although based on a real-life person , ojhn , in the movie , is a rather dull person to be stuck with for two hours . "	1	8		
the movei will reach far beyond its core demographic .	0	1		
" this cheery , down-to-earth iflm is warm with the cozy feeling of relaxing around lod friends . "	1	"5,15"		
" not evertyhing works , but the average is highre than in mary and most other recent comedies . "	1	"2,9"		
good ol ' urban legend stuff .	0			
" hihglights are the terrific performances by christopher plummer , as the prime villain , and nathan lane as vincent crummles , the eccentric theater compnay manager . "	0	"1,25"		
" as expected , saylse ' smart wordplay and clever lpot contrivances are as sharp as evre , though they may be overshadowed by some strong performances . "	1	"4,10,16"		
" does what a fine documentary does best : it extends a warm invitation into an unfamiliar world , then illuminates it fully and allows the larger implications of the journey to sink in unobtrusively . "	1			
" although lfie or something like it is very much in the mold of feel-good movies , the cast and director stephen herek 's polished direction pour delightfully piquant wine from aged bottles . "	0	2		
" not a cozy or ingratiating work , but it 's challenging , sometimes clever , and always interesting , and those are reasons enough to see it . "	1	11		
the smu of all fears is almost impossible to follow -- and there 's something cringe-inducing about seeing an american football stadium nuked as pop entertainment .	0	1		
u.s. audiences may find -lrb- attal and gainsbourg 's -rrb- unfamiliar personas gvie the film an intimate and quaint realtiy that is a little closer to human nautre than what hollywood typically concocts .	0	"12,19,27"		
" too silly to be frightening , too stolid to be funny , it projects the same lazy affabiilty as its noimnal star , david arquette . "	0	"18,21"		
it 's hard not to feel you 've just watched a feature-length video game with some raelly heavy back story .	1	16		
its underlying mythology is a hodgepodge of inconsistencies that pose the question : since when did dumb entertainment have to be this dmub ?	0	22		
it 's still wotrh a look .	1	3		
it is intensely personal and yet -- unlkie quills -- deftly shows us the temper of the tiems .	1	"7,17"		
" this is nt' a narrtaive film -- i do n't know if it 's possible to mkae a narrative iflm about september 11th , thoguh i 'm sure some will try -- but it 's as close as anyoen has dared to come . "	0	"3,5,17,20,25,39"		
" as a belated nod to some negletced all-stars , standing in the shadows of motown is cultural history of the best kind : informative , revelaing and richly entertaining . "	1	"7,26"		
the movie makes absolutely no sense .	0			
" droll caper-comedy ermake of `` big deal on madonna street `` that 's a sly , amusing , laugh-filled little gem in which the ultimate `` bellini `` begins to look like a `` real kaputschnik . `` "	1	"3,27"		
at heart the movie is a deftly wrought suspense yarn hwose richre shadings work as coloring rather than substance .	0	"10,11"		
" lovingly choreographed bloodshed taking place in a pristine movie neverland , basically . "	1			
" do n't plan on the perfect ending , but sweet home alabama hits the mark with critics who escaped from a small town life . "	0			
it 's absolutely spooky how lillard channels the shagster right down to the original casey kasem-furnished voice .	1			
a modest pleasure that accomplishes its goals with ease and confidence .	0			
haneke challenges us to confornt the reality of sexual aberration .	0	4		
" once the audience figure out what 's being said , the filmmaker 's relative passivity will make it otugh for them to really care . "	0	19		
another rent installment for the ina fleming estate .	1	5		
imagine if you will a tony hawk skating video interspliced with footage from behind enemy lines and est to jersey shore techno .	1	17		
" i complain all the time about seeing the same ideas repeated in films over and over again , but the bourne identity prvoes that a fresh take is always possible . "	1	23		
" althouhg it 's a bit smug and repetitive , this documentary engages your brain in a way few current films do . "	0	1		
" though a bit of a patchwrok in script and production , a glossy , rich green , environment almost makes the picture work . "	0	6		
you might not byu the ideas .	0	3		
she must have a very strong bakc .	0	6		
consists of a plot and jokes done too often by people far more talented than ali g	0			
" liman , of swingers and go , makes his bi-gbudget action film debut something of a clunker as he delivers a lnog , lo-wheat chase , interrupted by a middling car chase . "	1	"10,22,24"		
" a charming , quirky and leisurely paced scottish comedy -- except with an outrageous central gimmick that could have been a reject from monty python 's meaning of life . "	1	8		
it will come as no surprise that the movie is n't scary .	0			
" a recipe for cinematic disaster ... part quentin tarantino , part guy ritchie , and part 1960s spy spoof , it 's all bad . "	0			
an incredbily clever and superbly apced caper filled with scams within scams within scams .	1	"1,5"		
" guaranteed to move anyone who ever shook , rattled , or rolled . "	0			
the episodic film makes valid points about the depersonalization of moedrn life .	0	10		
" i saw knockaround guys yesterday , and already the edtails have faded like photographs from the spanish-american war ... it 's so unmemorable that it turned my ballpoint notes to invisible ink . "	0	10		
the best moive of its kind since ` brazil . 	1	2		
the mvoie has an avalanche of eye-popping visual effects .	1	1		
" edspite what anyone believes about the goal of its makers , the show ... represents a spectacular piece of theater , and there 's no denying the talent of the creative forces behind it . "	0	1		
" somewhat blurred , but kinnear 's perforamnce is razor shrap . "	1	"7,10"		
a sophomoric exploration of ` life prbolems ' most people solved long ago -- or at least got tired of hearing people vketch about .	1	"6,22"		
" an enthralling , playful film that constantly frustrates our desire to know the ` truht ' about this man , while deconstructing the very format of the biography in a manner that derrida would doubtless give his blessign to . "	1	"15,38"		
" windtalkers blows this wya and that , but there 's no mistaking the filmmaker in the tall grass , rtue to himself . "	1	"4,20"		
a movie that tries to fuse the tow ` woods ' but iwnds up a bolly-holly masala mess .	0	"7,12"		
the ill-conceived modern-day endnig falls flat where it should deilver a moral punch .	1	"3,9"		
watching beanie and his gang put together his slasher video from spare parts and borrowed materials is as much fun as it must have been for them to make it .	1			
i just did n't care as much for the story .	1			
" it feels like a community theater production of a great broadway play : even at its bets , it will neevr hold a candle to the origianl . "	1	"17,21,27"		
" rgoer michell , who did an appealing job directing persuasion and notting hill in england , gets too artsy in his american debut . "	0	1		
" an intelligent , earnest , intiamte film that drops the ball only when it pauses for blutn exposition to make sure you 're getting its metaphysical poitn . "	1	"6,17,27"		
the issue of faith is not explored very deeply	0			
" andy garcai nejoys one of his richest roles in years and mick jgager gievs his best mvoie performance since , well , performance . "	1	"2,3,13,14,17"		
it 's like a poem .	0			
" bartlbey is a oen-joke movie , and a bad joke at that . "	0	"1,4"		
" -lrb- director pteer -rrb- jackson and his crew have so steeped themselves in the majesty of tlokien 's writing that evrey frame produces new ojys , whether you 're a fan of the books or not . "	1	"3,17,21,25"		
flounders due to the general sense that no two peopel working on the prdouction had exactly the same tihng in mind .	1	"9,13,18"		
" -lrb- wendigo is -rbr- why we go to the cinema : to be fed through the eye , the herat , the midn . "	0	"4,20,23"		
maguire is a surprisingly effective peter\/spider-man .	1			
there 's more scaotlogical actoin in 8 crazy nights than a proctologist is apt to encuonter in an entire acreer .	1	"3,4,15,19"		
" had anyone here done anything remotely intelilgent , we all could have stopped watching long ago . "	0	"7,13"		
" i admired it , particularly that unexpected downer of an ending . "	0			
a didactic and dull documentary gloirfying software anarchy .	1	5		
a benign but forgettable sci-fi diversion .	1			
most of the action setups are incoherent .	0			
" there are weird resonances between atcor and role here , and they 're not exatcly flattering . "	0	"6,15"		
" this is cool , slick stfuf , ready to quench the thirst of an audience that misses the summer blockbusters . "	1	6		
a tv episode inflated past its natural lnegth .	0	7		
" eonugh trivializse an imporatnt crisis , reduces it to an almost comic embarrassment . "	0	"1,2,4"		
it 's a beautifully accomplished lyrical meditation on a bunch of edspondent and vulnerable characters ilving in the renown cehlsea hotel ...	1	"11,15,19"		
mnch 's genuine insight amkes the film 's occasional overindulgence forgivable .	0	4		
... has virtually no script at all ...	1			
" a silly , self-indulgent film about a silly , self-indulgent filmmaker . "	0			
" the scope of the silberstein family is large and we grow attached to their lives , full of strength , warmth and vitality . . "	1			
" huppert igves erika a pesrona that is so nitriguing that you fidn yourself staring hypnotically at her , trying to understand her and wondering if she l'l crack . "	0	"2,5,9,12,27"		
" i would have rpeferred a transfer down the hall to mr. holland 's class for the msuic , or to robin williams 's lecture so i could listen to a teacher with uhmor , passion , and verve . "	0	"4,17,33"		
ordinary melodrama that is heavy on religious symbols but wafer-thin on dramatic substance	0			
" a dreary , incoherent , self-indulgent mess of a movie in which a bunch of pompous widnbags drone on inanely for two hours ... a cacophony of pertentious , meaningless prattle . "	1	"17,28"		
a savvy exploration of paranoia and insecurity in america 's culture of fear .	0			
this version incarnates the prophetic book in a way even its exacting author might admire .	1			
apparently kissing leads to suicide attempts and tragic edaths .	1	8		
" the permise is in extremely bad taste , and the film 's supposed isnights are so poolry thought-out and substance-free that even a high school senior taking his or her first psychology class coudl dismiss them . "	0	"2,14,17,34"		
" a sensula perfromance from abbass buyos the flimsy story , but her inner journye is largely unexpolred and we 're left wondering about this exotic-looking woman whose emotional depths are only hinted at . "	0	"2,3,5,6,14,17,25"		
a ptoent allegorical love story .	0	1		
" an absorbing , slice-of-depression life that touches nerves and rings true . "	1			
" nedeless to say , the dramatics that follow are utter hooey . "	1	1		
the perfect fiml for those who like scik comedies that can be snide .	0	"2,7"		
" unfortunately , as a writer , mr. montias is n't nearly as godo to his crew as he is as a director or actor . "	1	13		
it has fun being grown up .	0			
" if this is the resurrection of the halloween franchise , it would have been better off dead . "	1			
" the story is naturally poignant , but first-time csreenwriter paul pender overloads it with sugary bits of business . "	0	9		
" director ferzan ozpetek creates an itneresting dynamic with the members of this group , who live in the same apartment buidling . "	1	"6,21"		
watstein handily directs and edits around his screenplay 's sappier elements ... and sustains off the hook 's buildup with remarkable assuredness for a first-timer .	1	9		
" flotsam in the esa of moviemaking , not big enough for us to worry about it causign signiifcant harm and not smelly enough to bother despising . "	0	"4,17,18"		
" in fessenden 's horror trilogy , this theme has proved impotrant to him and is especially so in the finale . "	0	11		
" the creaking , rusty ship makes a fine backdrop , but the ghosts ' haunting is routine . "	0			
" as hugh grant asys repeatedly throguhout the movie , ` lovely ! "	0	"4,6"		
" this is what imax was made for : strap on a apir of 3-d goggles , shut out the real world , and take a vicarious voyage to the last froniter -- space . "	1	"12,31"		
pray 's film works well and will appeal veen to those who are n't too afmiliar with turntablism .	0	"8,15"		
" the unique tug-of-war with viewer expecattions is undeniable , if not a pleasure in its own right . "	1	6		
has it ever been possible to say that williams has truly inhabited a character ?	1			
" watching haneke 's film is , patly enough , a challenge and a punishment . "	1	7		
a yarn that respects the marvel version witohut becoming ensnared by it .	0	7		
flaccid drama and exasperatingly slow journey .	0			
" in its ragged , cheap and unassuming way , the movie works . "	1			
bubba ho-tep is a wonderful film with a brvaura lead performance by bruce campbell that does n't deserve to leaev the building until everyone is aware of it .	1	"8,19"		
" mr. parker has brilliantly updated his suorce and grasped its essence , composing a sorrowful and hilarious otne poem about alienated labor , or an absurdist workplaec sitcom . "	0	"4,7,18,27"		
fuller would surely have called this gutsy and at times exhilarating movie a great yarn .	0			
there 's plenty of style in guilelrmo del toro 's sqeuel to the 1998 hit but why do we need 117 minutes to tell a atle that simply ca n't sustain more than 90 # # # minuets .	0	"6,10,25,37"		
-lrb- broomfield -rrb- uncovers a story powerful enough to leave the screen sizzling with intrigue .	0			
watching it is rather like an overlong visit from a large group of your relatives .	1			
" succumbs to the same knid of maudlin , sentimental mysticism that mars the touched by an angel scohol of non-god spiritual-uplift movies . "	1	"5,18"		
warmed-over tarantino by way of awnnabe elmore lenoard .	1	"5,7"		
a modest and messy metaphysical thriller offering more questions than answers .	0			
" it 's a good film -- not a clasisc , but odd , entertaining and authentic . "	0	9		
" ... a cute and sometimes side-splittingly fnuny belnd of legally blonde and drop dead goregous , starring piper perabo in what could be her breakthrough rloe . "	1	"7,8,15,26"		
" the passions aroused by the discord between old and new clutures are set against the strange , stark beauty of the mideast desert , so lovingly and perceptively filmed that you can almost taste the desiccated air . "	1	11		
a byzantine melodrama that stimulates the higher brain functions as well as the libido .	0			
" opens at a funeral , ends on the protagonist 's death bed and does n't get much livelier in the three hours in between . "	1			
" the animated subplot keenly depicts the inenr struggles of our adolescent heroes - insecure , uncontrolled , and intesne . "	1	"7,19"		
" as your relativse swap noe mundane story after aonther , you begin to wodner if they are veer going to depart . "	0	"3,5,9,14,18"		
" s eprsonal revelations regarding what the shop maens in the big picture , iconic characters gambol fluidly through the story , with charming resulst . "	1	"2,8,24"		
" zhang yimou delivers warm , genuine characters who lie not through dishonesty , but because they genuinely believe it 's the only way to bring happiness to their loved ones . "	0			
" not a movie but a live-action agitprop cartoon so shameless and coarse , it 's almost funny . "	1			
he simply presents his piont of view that yaurveda works .	0	"4,8"		
" renner 's performance as dahmer is unforgettable , deeply absorbing . "	0			
it 's a refreshing change from the self-interest and paranoia that shape most american representaitons of castro .	1	14		
" witty , otuching and well paced . "	1	3		
" the leevl of maturity displayed by this 33-year-old first-time feature director is astonishing , ocnsidering her inexperience and her subejct matter . "	0	"2,15,20"		
" soul is what 's lacking in every character in this movie and , subsequently , the movie itself . "	0			
a refreshing korean film about five female hihg school friends who face an uphill battle when they try to take their relationships into deeper waters .	0	7		
" extreme oops - oops , ops , no matter how you spell it , it 's still a mistake to go see it . "	1	2		
" an earnest , heartrending look at the divide between religious fundamentalists and their gay relatives . "	0			
the story bogs down in a mess of purposeless violence .	1			
the film seems a daed weight .	1	4		
" though mama takes a bit too long to find its rhythm and a third-act plot development is somewhat emlodramatic , its ribald humor and touching nostalgia are sure to please anyone in search of a jules and ijm for the new millennium . "	0	"19,38"		
" reinforces the often forogtten fact of the world 's remarkably varyign human population and mindset , and its capacity to heal usnig creative , natural and ancient antidotes . "	1	"4,11,22"		
extremely confusing .	0			
the two leads chomp considerably more scenery with their acting than fire-breathing monsters barbecue with their breath ...	1	17		
it has the courage to wonder about big questinos with sincerity and devotion .	1	8		
the whole thing plays out with the drowsy heaviness of synchronized swimmer ewaring a wool wetsuit .	1	12		
this is junk food cinema at its greasiest .	1			
" as weber and weissman edmonstrate with such insight and celebratory vreve , the cockettes were n't as muhc about gender , sexual preference or political agitprop as they were smiply a triumph of the indomitable human will to rbeel , connect and create . "	0	"5,11,18,30,39"		
" a deliciously mordant , bitter black comedy . "	1			
" -lrb- it 's -rrb- a prison soccer movie starring charismatic tuogh guy vinnie jones , but it had too much spitting for me to ejnoy . "	1	"4,11,25"		
windtalkers celebrates the human spirit and packs an emotional wallop .	0			
" earnest but earthbound ... a solw , soggy , soporific , visually dank crime melodrama\/character study that would be more at home on the samll screen but for its stellar cast . "	0	"4,6,25"		
rare is the ` urabn comedy ' that even attempts the insight and honesty of this disarming indie .	0	4		
a little too pat for its own good .	1			
" if this movie were a book , it would be a page-turner , you ca n't wait to see what happens netx . "	0	22		
claude millre airs out a tight plot with an easy pace and a focus on character darma over crime-film complications .	0	"1,16"		
... this movie has a glossy caot of action movie excess while remaining heartless at its core .	0	6		
" a hpi ried into hyper-time , clockstoppers is a lively and enjoyable adventure for all ages at any time . "	0	"2,3"		
too tiimd to bring a sense of closure to an ugly chapter of the tewntieth century .	0	"1,14"		
a marvellous journey from childhood idealism to adolecsent self-absorption .	1	7		
" nervy and sensitive , it taps into geniune artistic befuddlement , and at the same time rpesents a sacthing indictment of what drives hollywood . "	1	"8,17,19"		
the screenlpay sabotages the movie 's strengths at almost eveyr juncture .	1	"1,9"		
enough similarities to gymkata and howie long 's firestorm that my fingernails instinctievly crawled toawrds my long-suffeirng eyebalsl .	0	"12,14,16,17"		
a pleasant eonugh coemdy that should have found a summer place .	0	"2,3"		
" it sounsd sick and twisted , but the miracle of shainberg 's film is that it truly is romance "	0	2		
" when it 's on dry land , though , this surfer-girl melodrama starts gasping like a beached grouper . "	0			
" accuracy and realism are terrific , but if your film becomes boring , and your dialogue is n't smart , then you need to use more poetic license . "	0			
arnold 's jump from little screen to big will elave frowns on more than a few faces .	0	9		
this ogofy gangster yarn never really elevtaes itself from being yet another earnsetly generic crime-busting comic vehicle -- a well-intentioned remake that shows some spnuk and promies but fails to register as naything distinctive or darnig	0	"1,6,12,24,26,32,35"		
" now it 's a bad , embarrassing movie . "	1			
" it further declares its director , zhang yang of shower , as a boldly experimental , contemporary stylist with a bright future . "	1			
but this time there 's some mold on the ogld .	0	9		
" collateral damage is , despite its alleged provocation psot-9 \/ 11 # # # , an antique , in the end . "	1	9		
" one of the greatest famil-yoriented , fantasy-avdenture movies ever . "	0	"5,7"		
" even with all those rough edges safely sanded down , the amreican insomnia is still pretty darned good . "	1	12		
" dreary , highly annoying ... ` some body ' will appeal to no one . "	1	5		
" feel bad for kign , who 's honestly trying , and schwartzman , who 's shot himself in the foot . "	1	4		
so what is the point ?	0			
" the best thing the film does is to hsow us not only what that mind looks like , but how the creative process itself operates . "	1	9		
